id,label,label_text,text,lang
3689,audio,audio,aumenta as colunas,pt
7700,calendar,calendar,limpo o meu calendário inteiro,pt
7763,calendar,calendar,qual é a minha agenda hoje,pt
15422,social,social,enviar esta mensagem para at microsoft no twitter,pt
3477,play,play,toca os sucessos do top vinte e cinco,pt
14625,qa,qa,dá me o preço das ações da apple,pt
10106,cooking,cooking,exibir receita de frango tandoori,pt
6022,weather,weather,esta um tempo agradável esta noite,pt
14548,qa,qa,a ana malhoa tem um escândalo,pt
16269,email,email,enviar resposta para roberto ao seu email recebido hoje de manhã,pt
13393,qa,qa,buscar massa do sol,pt
6899,calendar,calendar,remover todos os eventos do meu calendário,pt
9,iot,iot,tornar a iluminação um pouco mais calorosa aqui,pt
982,iot,iot,mudar a cor das luzes da minha casa de branco para amarelo,pt
5649,weather,weather,pede o tempo para hoje de manhã,pt
10384,play,play,apresenta os jogos que podes jogar comigo,pt
10184,cooking,cooking,qual a quantidade de açúcar num chá doce,pt
10921,lists,lists,o que é que tenho que completar primeiro na lista,pt
2162,music,music,repetir jazz,pt
10071,cooking,cooking,quanto tempo cozinha um frango inteiro a trezentos e cinquenta graus,pt
15184,social,social,quantos gostos teve o meu estado de ontem,pt
1585,music,music,por favor guarda a minha opinião sobre a música que está a tocar,pt
1616,news,news,alertar-me se surgir algum tópico relacionado com política,pt
15120,calendar,calendar,olly por favor agendar todas as minhas consultas médicas,pt
7284,calendar,calendar,apagar a consulta no dentista,pt
2967,iot,iot,luzes do escritório desligadas,pt
6453,transport,transport,voos mais baratos de ponta delgada para lisboa,pt
7415,calendar,calendar,repetir lembrete para o natal,pt
13053,qa,qa,alexa gostaria que o meu me dissesse as tendências em taxas de câmbio,pt
9866,play,play,põe o programa a partir de onde o deixei ontem,pt
16973,email,email,verificar se o meu email de spam tem phishing,pt
14106,qa,qa,quando é que o prince morrer,pt
15984,email,email,tenho mais algum outro número de telefone da alexandra,pt
7001,calendar,calendar,criar evento,pt
414,iot,iot,mudar minhas luzes do quarto para uma cor mais romântica,pt
241,weather,weather,o que se passa lá fora,pt
4037,iot,iot,sandle,pt
9257,play,play,tocar rádio,pt
7075,calendar,calendar,apagar o meu próximo evento no calendário,pt
3815,weather,weather,o sul vai estar quente amanhã,pt
11964,recommendation,recommendation,onde é que é o bar mais próximo,pt
5549,audio,audio,coloca em modo silêncio,pt
12109,recommendation,recommendation,preciso de todos os eventos locais para esta área que decorram este fim de semana,pt
7594,calendar,calendar,definir um lembrete em quinze minutos para mudar as roupas da lavadora,pt
10484,lists,lists,que lista está disponível para alimentos online,pt
11874,recommendation,recommendation,há algum concerto esta semana,pt
10343,play,play,abre o jogo minestart a partir do último nível jogado,pt
12577,transport,transport,há algum trânsito,pt
539,music,music,procura o nome do álbum com deolinda,pt
9078,calendar,calendar,aniversário da mãe amanhã,pt
2251,iot,iot,aspirar a sala comum em dez minutos,pt
14471,qa,qa,história de dom pedro segundo,pt
11635,recommendation,recommendation,a que horas vai passar um filme amanhã,pt
3130,weather,weather,está ventoso hoje,pt
6360,general,general,onde deveria levar a minha mulher a jantar hoje à noite,pt
9613,play,play,quais são as estações de rádio do norte,pt
5773,datetime,datetime,horas agora em lisboa,pt
2020,audio,audio,aumenta o volume em dois níveis,pt
4332,play,play,toca música pop,pt
12948,qa,qa,qual a capital da china,pt
7765,calendar,calendar,há alguma maneira de limpar o meu calendário,pt
3578,audio,audio,silencia por vinte minutos,pt
6528,general,general,quem vai vencer esta eleições presidenciais,pt
8917,calendar,calendar,repetir evento no calendário,pt
10932,lists,lists,juntar músicas à minha lista favorita,pt
1099,datetime,datetime,quando é o próximo mês que tem trinta e um dias,pt
5895,play,play,tocar billie jean a seguir,pt
4698,alarm,alarm,lembrar me às cinco da tarde,pt
8401,calendar,calendar,a minha reunião com o duarte é amanhã às três da tarde,pt
7614,calendar,calendar,diz me o próximos eventos,pt
13443,news,news,mais recente telefone samsung,pt
8242,calendar,calendar,olly limpar tudo do meu calendário para o resto do ano,pt
13054,qa,qa,gostava que me contasse a tendência das taxas de câmbio estrangeiras,pt
4713,alarm,alarm,não me acordar aos finais de semana,pt
11289,general,general,consiga,pt
16264,email,email,o roberto enviou-me algum email novo,pt
10613,lists,lists,todos os produtos com o prefixo pré devem ser removidos da lista,pt
15856,email,email,enviar email para o actual endereço de email,pt
14821,qa,qa,compara mais países,pt
5734,play,play,toca a música do michael jackson novamente por favor,pt
10404,play,play,joga comigo,pt
3185,general,general,conta me uma anedota sobre advogados,pt
4588,play,play,alexa põe as minhas favoritas,pt
13981,qa,qa,posição do dólar americano agora,pt
11556,play,play,quero ouvir algo do paulo gonzo,pt
5799,news,news,recentemente lançado com quatro rodas,pt
15268,social,social,diz-me o que está a acontecer nas redes sociais,pt
1414,iot,iot,alexa necessito de café feito,pt
4169,weather,weather,pode ver por favor o tempo no porto,pt
2177,weather,weather,dá-me as condições do tempo atuais,pt
6833,calendar,calendar,lembra me amanhã às quatro acerca de um evento,pt
14583,qa,qa,quantas rupias tem em um dólar,pt
972,news,news,o que vai acontecer amanhã,pt
16913,email,email,existem quaisquer emails não lidos desta pessoa,pt
9027,calendar,calendar,adicionar ao calendário uma consulta médica para o primeiro dia dos próximos cinco meses,pt
10664,lists,lists,o que consta da minha lista hoje,pt
2820,iot,iot,muda as luzes da casa para uma tonalidade azulado,pt
8957,calendar,calendar,abrir o restante e encontrar o horário da reunião,pt
6889,calendar,calendar,clicar em guardar,pt
8658,calendar,calendar,preciso de apagar tudo do meu calendário por favor,pt
537,alarm,alarm,põe um alarme para as nove da manhã,pt
8587,calendar,calendar,agenda de hoje,pt
12726,transport,transport,quão lento está o trânsito na a. cinco,pt
17164,email,email,reenviar um email à susana,pt
15465,social,social,verificar as noticias nas redes sociais,pt
15689,social,social,ir ao site das reclamações do starbucks,pt
10400,play,play,jogar bilhar,pt
12336,transport,transport,quão longe é daqui até lagos de comboio,pt
14072,qa,qa,onde está a carmen sandiego,pt
7172,calendar,calendar,pedro quer encontrar nos domingos às onze podes lembrar me nos sábados à noite todas as semanas,pt
784,play,play,toca todas as músicas de rock,pt
16925,email,email,eu recebi algum email nas última hora,pt
6805,calendar,calendar,tenho algum evento no meu calendário amanhã de manhã das dez às onze,pt
4365,datetime,datetime,que horas são no porto,pt
4910,play,play,tocar as músicas novas por linda martini,pt
8398,calendar,calendar,adicionar compras no shopping no dia vinte e seis de março ao meio-dia,pt
13785,qa,qa,qual é a taxa de câmbio entre a libra e o dólar americano,pt
5164,iot,iot,escurece o quarto um bocado,pt
15781,email,email,ei google envie um email para carolina dizendo quando ela pode me enviar os updates do último projeto cumprimentos tomaz,pt
6738,general,general,vou tirar o dia de amanhã,pt
326,weather,weather,noite,pt
3509,iot,iot,desligar as luzes na cozinha,pt
11105,lists,lists,lista de afazeres,pt
12237,transport,transport,chama um táxi para agora,pt
9063,calendar,calendar,adicionar aniversário da ana ao calendário no dia vinte e dois de junho,pt
7307,calendar,calendar,apanhar todos os eventos deste mês,pt
10134,cooking,cooking,encontra uma receita para arroz frito tailandês,pt
5509,general,general,conte uma anedota,pt
13918,qa,qa,o que é uma lavadora de alta pressão,pt
7337,calendar,calendar,que há no meu calendário amanhã,pt
11641,recommendation,recommendation,o que está a acontecer na zona,pt
3892,audio,audio,silencia imediatamente,pt
14965,qa,qa,qual é a taxa de câmbio para as acções da wells fargo,pt
7135,calendar,calendar,marcar uma reunião para amanhã,pt
4128,alarm,alarm,tenho alguns alarmes definidos atualmente,pt
340,iot,iot,alexa ajudei uma pessoa necessitada hoje,pt
6218,general,general,hoje fui ao supermercado,pt
4019,datetime,datetime,quando é o próximo feriado,pt
12556,transport,transport,quanto tempo para chegar ao trabalho,pt
6896,calendar,calendar,adiciona uma marcação com o meu dentista para a próxima segunda-feira às dez da manhã,pt
10502,lists,lists,preciso de acrescentar massa e leite à lista de mercearia,pt
6814,calendar,calendar,aniversário da mãe uma semana antes,pt
10113,cooking,cooking,como cozinhar um bom hambúrguer olly,pt
10705,lists,lists,verifica a app de notas e diz me os detalhes de todas as listas,pt
36,general,general,verifica se o meu carro está pronto,pt
3544,iot,iot,ligar a luz verde nesta sala,pt
6941,calendar,calendar,lembrar-me reunião com o cliente às dezasseis horas,pt
6375,music,music,olly qual é um bom álbum de rap que tenha saído este ano,pt
10330,play,play,vamos jogar damas,pt
16800,email,email,existem alguns emails da cláudia para o hélder,pt
15650,social,social,quem me escreveu ou me mencionou nas redes sociais,pt
95,alarm,alarm,programar o alarme para oito todos os dias úteis,pt
17008,email,email,recebi recentemente algum email,pt
3278,iot,iot,diminuir as luzes no meu quarto,pt
11748,recommendation,recommendation,o que está a acontecer em coimbra,pt
7600,calendar,calendar,tenho alguns eventos a decorrer na próxima semana,pt
9954,cooking,cooking,a que temperatura deve estar o frango assado no forno,pt
3739,news,news,mostrar as notícias de hoje mais recentes no mundo,pt
9306,play,play,começa a estação de rádio para mim,pt
3079,music,music,podes sacar a informação do vocalista desta música,pt
6167,audio,audio,desligar notificações durante cinco minutos,pt
2362,takeaway,takeaway,encontre o restaurante chinês mais próximo de entrega,pt
7190,calendar,calendar,o que há no calendário hoje,pt
12830,transport,transport,reserva um táxi de luxo da bolt,pt
17000,email,email,mostrar meu último email,pt
13360,qa,qa,o que significa obsecado,pt
13240,general,general,qual é a média do preço de uma casa na guarda,pt
10829,lists,lists,o que é a seguir na minha lista,pt
16782,email,email,pode enviar um email para a minha mãe sobre o tempo semanal,pt
12562,transport,transport,procura um bilhete de comboio para gaia no dia catorze de abril,pt
872,iot,iot,desligar a luz no quarto,pt
1142,datetime,datetime,diz-me que dia da semana é,pt
8340,calendar,calendar,apagar o meu próximo evento,pt
12959,general,general,explica como é que status social dos e. u. a. difere do reino unido agora e no passado,pt
13065,general,general,estou a conduzir por favor atende automaticamente as minhas chamadas no altifalante,pt
5089,news,news,siri o que aconteceu nas notícias de hoje,pt
16420,email,email,verificar emails não lidos,pt
4382,weather,weather,qual é a previsão de tempo na próxima semana no porto,pt
2984,alarm,alarm,apaga o alarme agendado,pt
3180,alarm,alarm,gostaria de definir um alarme para este sábado às dez horas,pt
11966,recommendation,recommendation,onde têm bom restaurante,pt
6016,news,news,o governador já promulgou a nova lei do crime,pt
12434,transport,transport,procura um comboio para coimbra,pt
2331,weather,weather,como está o tempo agora,pt
6750,calendar,calendar,o que se segue na minha agenda,pt
5124,weather,weather,está quente ou frio lá fora,pt
5430,weather,weather,vai estar frio o suficiente para luvas hoje à noite,pt
12780,transport,transport,chama um uber agora,pt
15339,social,social,enviar esta mensagem ao twitter,pt
6257,general,general,olá é a tua primeira vez aqui,pt
13838,qa,qa,pode me ajudar em encontrar respostas para responder essas questões,pt
8108,calendar,calendar,apagar o próximo evento,pt
14369,general,general,é masculino ou feminino,pt
6698,general,general,olá siri hoje fui despedido do meu trabalho,pt
1720,alarm,alarm,define um alarme para todas as terças-feiras de março às oito da manhã,pt
3730,news,news,por favor diga me as últimas escolhas do time do porto,pt
5223,news,news,quais são as últimas notícias sobre o donald trump,pt
2096,takeaway,takeaway,o qianlixiang buffet aceita encomendas online ou não,pt
13581,qa,qa,que vulcões estão neste momento ativos,pt
14990,weather,weather,qual o tempo na nossa cidade,pt
7829,calendar,calendar,o que está mais na lista,pt
1828,news,news,fale-me alguma notícia de última hora em nova iorque,pt
12188,transport,transport,como está o trânsito no centro da cidade,pt
9786,play,play,põe o meu livro,pt
4015,alarm,alarm,remover o meu alarme para acordar,pt
14167,qa,qa,informação sobre rowan atkinson,pt
1330,music,music,qual o nome desta música,pt
735,audio,audio,poderias baixar o volume por favor,pt
12657,transport,transport,reservar um táxi para apanhar luísa fernandes na porta quatro do aeroporto para a chegada do voo cinco quatro três um às três e vinte da manhã de sexta-feira,pt
13542,iot,iot,ligar o forno,pt
14432,qa,qa,quantos ienes rende um dólar americano hoje,pt
5844,weather,weather,devo usar protetor solar hoje,pt
12061,transport,transport,quão longe é o pingo doce daqui,pt
3691,weather,weather,qual é a temperatura atual em lisboa,pt
15931,email,email,avisa-me quando chegar algum novo email da raquel,pt
14480,general,general,diz me a velocidade para ir,pt
139,play,play,põe a minha playlist de jazz,pt
6847,alarm,alarm,configura um alarme na quarta feira de tarde para que eu possa registar no plano de formação para a adoção,pt
15144,social,social,publica o estado para o seguinte,pt
1326,takeaway,takeaway,esse restaurante aceita pedidos para levar ou não,pt
14242,qa,qa,nome pessoal,pt
6349,general,general,hey whatsapp,pt
7203,calendar,calendar,quais eventos eu tenho planejado para as próximas duas semanas,pt
2398,play,play,inicia marco paulo,pt
11462,play,play,liga o ricardo araújo no podcast,pt
11683,recommendation,recommendation,mostra me onde é que ou posso encontrar um hamburger,pt
16080,email,email,enviar email para a minha mãe,pt
4628,weather,weather,a que horas vai chover amanhã,pt
11925,recommendation,recommendation,diz me cafés perto da baixa lisboeta,pt
4562,datetime,datetime,olly podes converter o meu fuso horário para o fuso horário em que estou atualmente,pt
8628,calendar,calendar,lembrar-me todos os dias cinco às cinco da manhã,pt
13833,qa,qa,quantos bots são em um dólar,pt
3830,alarm,alarm,já não preciso do alarme diário das cinco da tarde,pt
736,audio,audio,podes por favor gritar a resposta para mim,pt
2958,iot,iot,ligar o aspirador robot,pt
16741,email,email,consultar o meu email na última hora,pt
7799,calendar,calendar,mostrar me os eventos adicionados recentemente,pt
10639,lists,lists,o que é que eu preciso para a minha estadia,pt
8465,calendar,calendar,envia-me aviso de reunião na quarta-feira às nove da manhã,pt
5418,general,general,alguma coisa que precise de saber,pt
2080,alarm,alarm,o meu alarme de despertar está ajustado a seis da manhã,pt
11518,play,play,vai para o próximo episódio do podcast a minha vida dava um filme,pt
15058,qa,qa,diz me a definição de seta,pt
3367,news,news,qual a manchete no diário de notícias,pt
13589,qa,qa,por favor diga-me o que é uma cambota,pt
2760,play,play,começa a tocar música,pt
3017,takeaway,takeaway,o restaurante chinês entrega ao domicílio,pt
11897,recommendation,recommendation,há algo a acontecer na cidade este fim de semana,pt
8197,calendar,calendar,tenho alguns lembretes pendentes,pt
7698,calendar,calendar,lembrar me disto no futuro,pt
2155,datetime,datetime,que horas são agora mesmo,pt
7807,calendar,calendar,não meu deixe esquecer que eu tenho reunião de pais esta segunda-feira às quatro da tarde,pt
16783,email,email,a minha mãe precisa que lhe seja enviada a metereologia semanal,pt
7497,calendar,calendar,está o jantar de aniversário de sexta-feira no calendário,pt
17122,email,email,por favor começa um email para a minha irmã,pt
2099,takeaway,takeaway,mostra o king long online,pt
11167,lists,lists,juntar leite á minha lista de compras,pt
1728,weather,weather,por favor confirma a previsão do tempo para dia treze deste mês,pt
5162,alarm,alarm,quero acordar às seis da manhã,pt
2632,datetime,datetime,mostra-me a data de hoje em formato americano,pt
13709,qa,qa,quão longe é coimbra,pt
12865,transport,transport,diz-me a hora do comboio que vai de coimbra para faro,pt
6641,general,general,memorando,pt
7895,calendar,calendar,dar me uma actualização sobre a eleição amanhã ao meio dia,pt
7795,calendar,calendar,onde é a reunião de terça feira de manhã,pt
3519,iot,iot,aumentar as luzes,pt
7634,calendar,calendar,para os próximos três domingos lembrar me que tenho aula de ioga ao meio dia,pt
7884,calendar,calendar,olly marcar reunião às sete da noite,pt
2521,news,news,mostre-me o que está a acontecer,pt
3350,audio,audio,onde está o fogo,pt
13990,qa,qa,onde é o gerês,pt
4204,weather,weather,vai estar neve esta semana,pt
7473,calendar,calendar,lembrar-me da reunião com o meu professor hoje às cinco da tarde,pt
4592,alarm,alarm,quais são os próximos alarmes,pt
12472,transport,transport,paga o bilhete de comboio,pt
6081,weather,weather,preciso de um blusão hoje,pt
2661,iot,iot,desligar as luzes da cozinha,pt
10974,lists,lists,coloca no ecrã as listas que eu tenho disponíveis,pt
14201,qa,qa,olly pode dizer-me o preço das acções do google,pt
9076,calendar,calendar,dá-me o horário,pt
7992,calendar,calendar,escreve na minha agenda eu tenho evento na próxima sexta-feira,pt
2961,music,music,repetir todas,pt
4895,news,news,principais notícias de desporto,pt
2727,iot,iot,desligar o dispositivo shelly,pt
6930,calendar,calendar,quero adicionar um evento ao meu calendário,pt
17024,email,email,enviar um email à mãe e ver como estará o tempo para a semana,pt
13497,qa,qa,define palavra,pt
3126,general,general,alexa quantos tornados houve este mês,pt
7657,calendar,calendar,dar me a lista de tarefas para hoje,pt
9508,play,play,procura marco paulo na rádio,pt
4864,weather,weather,diz me o tempo no porto,pt
1384,datetime,datetime,em que data é a terceira sexta-feira de este mês,pt
13090,general,general,encontrar-me uma boa loja de vinho que armazene vinhos velhos com mais de dez anos de idade navegar-me até essa loja,pt
4635,audio,audio,baixa o volume da coluna,pt
11012,lists,lists,o que segue na minha lista de compromissos,pt
13675,qa,qa,qual é o atual preço das ações da amazon,pt
4260,audio,audio,aumentar o volume,pt
11159,lists,lists,remover batatas doces,pt
9157,calendar,calendar,alerta,pt
16102,email,email,enviar um email ao meu chefe acerca da minha licença,pt
12642,transport,transport,preciso de partir no comboio das cinco da tarde para ponte de sor,pt
5092,music,music,siri salta duas músicas,pt
38,general,general,a luminosidade do meu ecrã está baixa,pt
15253,social,social,que amigos estiveram em lugares populares no último dia,pt
7267,calendar,calendar,ei garantir que eu vou à festa de aniversário da sara no dia doze,pt
4989,music,music,qual playlist está no modo aleatório,pt
16681,email,email,enviar email para o bruno olá senti a tua falta ontem queres sair para jantar hoje à noite,pt
14561,general,general,que coisas fazem as mulheres felizes,pt
4517,takeaway,takeaway,verifica o estado do meu pedido,pt
16941,email,email,envia um email através do outlook,pt
11038,lists,lists,apaga molas de borboleta da minha lista de desejos,pt
3256,general,general,me entregue a mais recente notícia da daniela melchior,pt
16740,email,email,o que a ema e eu pegamos noite passada,pt
4901,audio,audio,baixa o volume da média,pt
1441,play,play,põe todas as músicas indie pop,pt
973,news,news,quais são as últimas noticias,pt
10042,cooking,cooking,onde posso encontrar aquela receita para barras de biscoito mágicas,pt
2078,audio,audio,baixa um pouco o volume por favor,pt
5945,calendar,calendar,lembrar minha amiga de pegar a tarefa amanhã,pt
12271,transport,transport,podes reservar-me um bilhete de comboio para o porto amanhã em qualquer comboio,pt
16439,email,email,preciso que envies um email meu amigo,pt
5928,iot,iot,por favor liga a máquina do café e começa um ciclo de preparação,pt
13557,qa,qa,qual a capital da cidade do colorado,pt
8178,calendar,calendar,convidar o s. r. ricardo para uma reunião na próxima segunda às seis da tarde,pt
7507,calendar,calendar,quantas reuniões há no meu calendário hoje,pt
1950,news,news,alguma notícia de última hora,pt
8166,calendar,calendar,por favor adicionar reunião com sra. barros na quarta feira às oito horas da manhã no meu calendário,pt
7581,calendar,calendar,listar a minha reunião de hoje,pt
13831,qa,qa,quão alta é a torre de londres,pt
7063,calendar,calendar,deletar todos os eventos do meu calendário,pt
2618,news,news,adicionar uma notificação para notíciasaominuto sobre o tempo,pt
8567,calendar,calendar,agendar o brunch às dez da manhã hoje e convidar a teresa e a joana,pt
11956,recommendation,recommendation,olly que filmes estão em exibição perto de mim,pt
10900,lists,lists,ajuda-me a definir uma lista,pt
9564,play,play,liga o rádio sintoniza na comercial com o volume no máximo como alarme de manhã,pt
15416,social,social,tweet vendedor grosseiro,pt
11492,play,play,toca a minha playlist de favoritas de country,pt
6800,calendar,calendar,eu tenho algum reunião amanhã de manhã,pt
6510,email,email,emails,pt
8428,calendar,calendar,olly adicionou compromisso de almoço com maria para dois de janeiro ao meio dia e meia,pt
16093,email,email,informe me sobre quaisquer emails recebidos na última hora por favor,pt
6704,general,general,pensas no dia em que vais expirar,pt
12819,transport,transport,reserva um bilhete de comboio para a covilhã,pt
7285,calendar,calendar,apagar todas as próximas sessões de yoga,pt
14799,qa,qa,qual a capital da tanzania,pt
7297,calendar,calendar,pega meu calendário e liberte o,pt
16675,email,email,envia um email a jota jota arroba gmail ponto com,pt
1269,news,news,o que está a acontecer no mundo agora,pt
14941,qa,qa,abrir calculadora,pt
1824,music,music,eu gosto de músicas de,pt
13820,qa,qa,maria joão abreu ainda está viva,pt
10314,play,play,vamos jogar xadrez juntos,pt
7584,calendar,calendar,por favor verifique o seu calendário eu fiz algumas coisas,pt
14472,qa,qa,conquistas de cristiano ronaldo,pt
9699,play,play,inicia o ficheiro do audiolivro onde eu parei em o mistério da estrada de sintra,pt
10574,calendar,calendar,tenho algumas tarefas hoje,pt
3866,news,news,obter notícias do diário de nóticias,pt
12283,transport,transport,a que horas é o comboio para beja,pt
16169,email,email,abrir email para mensagens não lidas,pt
7347,calendar,calendar,vinte de julho é o aniversário da silvia atualize o meu calendário com essa data,pt
959,iot,iot,conector o robot através de bluetooth,pt
6853,calendar,calendar,ir para o próximo evento no calendário e apagá lo,pt
13525,general,general,gostaria que ajudasse com depuração do código,pt
14951,qa,qa,abrir internet,pt
8054,calendar,calendar,apagar todos os eventos de sete de março,pt
10650,lists,lists,que listas eu criei,pt
10737,calendar,calendar,o que é que tenho na agenda para hoje,pt
16555,email,email,em que rua vive a sara consultar a minha lista telefónica,pt
12269,transport,transport,o correio de lisboa chega a tempo ao porto,pt
7443,calendar,calendar,quem vai à festa,pt
17022,email,email,alexa envia um email à mãe a perguntar como está o tempo lá,pt
7716,calendar,calendar,colocar no meu calendário uma festa de aniversário com o joão manuel e a amélia,pt
12973,qa,qa,qual o capital financeiro do canadá,pt
8306,calendar,calendar,lembrar-me do jantar com a mãe esta noite no meu calendário,pt
775,news,news,notifiquem-me quando sócrates estiver nas notícias,pt
7389,calendar,calendar,retirar a data do jantar marcado para esta sexta-feira às nove da noite,pt
4788,music,music,o que está na minha pasta de música favorita,pt
11100,lists,lists,coloca isto numa lista,pt
5562,news,news,quais são os cabeçalhos das notícias,pt
9046,calendar,calendar,apaga todos os eventos de tutoria na semana de dia vinte,pt
8711,calendar,calendar,meu calendário hoje,pt
667,iot,iot,reduzir a intensidade,pt
2067,news,news,alguem ganhou o euromilhões ontem,pt
7862,calendar,calendar,vou ao concerto da mariza em lisboa a vinte e quatro de março,pt
1444,audio,audio,silêncio,pt
7050,calendar,calendar,calendário google adiciona evento para vinte um de março e,pt
3557,play,play,põe a playlist de yoga,pt
971,news,news,o que há de novo hoje,pt
5415,takeaway,takeaway,pede para mim uma piza simples grande da pizzaria al forno,pt
9917,cooking,cooking,o que é preciso para fazer pizza,pt
17180,email,email,verificar email de joão,pt
7160,calendar,calendar,lembrar disto daqui a dois dias,pt
16387,email,email,abrir todos os emails não lidos,pt
12638,transport,transport,por favor vê os horários do comboio para ponte de sor na quarta-feira às cinco da tarde,pt
8963,calendar,calendar,lembra-me do meu aniversário,pt
11534,play,play,começa o próximo episódio,pt
13251,general,general,qual é o meu relatório astrológico para hoje,pt
16645,email,email,tenho um número para josé,pt
12876,transport,transport,ligue para táxis de lisboa e reserve um táxi para três horas em ponto da manhã,pt
15003,qa,qa,em que ano o nicolau breyner morreu,pt
12649,transport,transport,como está o trânsito hoje,pt
12143,transport,transport,o que é o tráfego,pt
11737,qa,qa,olly quantas estrelas recebeu o indiana jones na imdb,pt
