id,label,label_text,text,lang
7887,calendar,calendar,que reuniões eu tive na última semana,pt
9293,play,play,encontra alguma rádio com debates,pt
141,play,play,põe a minha playlist favorita,pt
9854,play,play,continua música twilight,pt
3633,play,play,quero ouvir a minha playlist de música country,pt
8211,calendar,calendar,marcar um encontro com o miguel para a próxima quinta-feira de manhã,pt
4208,weather,weather,devo usar sandálias,pt
6680,news,news,o que está a acontecer nas notícias,pt
14754,qa,qa,qual o fuso horário de cuba,pt
6943,calendar,calendar,definir um evento de calendário,pt
5878,music,music,adoro a voz eterna da cantora ela é a minha favorita,pt
15878,email,email,procurar a morada residencial do chefe de equipa,pt
6957,calendar,calendar,limpa o meu calendári,pt
10619,lists,lists,quero iniciar uma lista nova de ferramentas elétricas em promoção no intermarché,pt
15566,social,social,informa a real hamburgueria que não gosto deles,pt
12690,transport,transport,com está o trânsito na i. c. dezanove,pt
16302,email,email,podes-me dizer o email da tia rute,pt
15295,social,social,que publicações novas há na minha página,pt
13195,qa,qa,quão alto é channin tatum,pt
3541,play,play,quero ouvir contentores dos xutos e pontapés,pt
3782,play,play,seleciona a playlist de r and b dos nineties por favor,pt
834,news,news,conte-me as últimas notícias do mais futebol,pt
14649,cooking,cooking,como cozinhar,pt
6011,datetime,datetime,o que diz o relógio,pt
14715,general,general,por favor explica a cultura chinesa,pt
5492,alarm,alarm,podes desligar o alarme,pt
10859,lists,lists,remover esse evento da lista,pt
287,iot,iot,clareie a lâmpada perto do sofá,pt
12900,transport,transport,reserva um bilhete de comboio para mim dia três de julho,pt
12531,transport,transport,qual o horário do comboio da manhã para braga,pt
15517,social,social,enviar um tweet sobre o mau serviço prestado pelo restaurante tandoori,pt
7425,calendar,calendar,mostrar-me os lembretes,pt
7178,email,email,envia uma mensagem de voz ao escritório do s. r. ricardo sobre reunir com ele no dia um de fevereiro de dois mil e dezassete às cinco da tarde,pt
6696,general,general,olá olly acabei de perder a minha carteira hoje,pt
16051,email,email,verificar o email da yahoo,pt
14180,qa,qa,o que é a capital de nova iorque,pt
13442,qa,qa,quantos anos tem cristiano ronaldo,pt
255,music,music,olly que músicas costumo ouvir depois do trabalho,pt
6691,general,general,como posso tornar o teu dia um pouco melhor,pt
5825,play,play,colocar na fila boa companhia por luís severo,pt
1707,audio,audio,baixa as colunas para cinco por cento,pt
308,takeaway,takeaway,pede uma sanduíche takeaway e uma sopa do italiano,pt
15390,social,social,gere o estado do facebook,pt
13931,qa,qa,verificar moedas,pt
8187,calendar,calendar,avise-me um dia antes da minha próxima reunião,pt
5260,music,music,adiciona esta música à minha música,pt
15549,social,social,enviar a minha reclamação à samsung via tweet,pt
16680,email,email,criar um email para o meu irmão a perguntar a que horas chega para jantar,pt
5388,music,music,quem é que toca esta música,pt
14160,qa,qa,qual é o país com maior densidade populacional,pt
6383,general,general,vendes a minha informação a anunciantes,pt
9590,play,play,põe ma mixórdia de temáticas da comercial na rádio comercial,pt
2702,play,play,põe música rock por favor,pt
6748,calendar,calendar,qual é um meu lembrete mais antigo,pt
3191,play,play,reproduz a playlist que estávamos a ouvir na última noite,pt
6868,calendar,calendar,pode me informar sobre o cronograma dos próximos eventos,pt
11071,lists,lists,por favor remover tomates da lista de mercearias,pt
6629,general,general,qual é o nome do melhor restaurante italiano,pt
10906,lists,lists,faz-me uma nova lista,pt
9835,play,play,música um,pt
3938,play,play,procura todos os temas de fausto e toca,pt
3156,alarm,alarm,o miguel vai-me enviar um email amanhã pode por favor configurar um alarme quinze minutos depois de receber esse email,pt
2513,iot,iot,como ligo o timer na minha máquina de café,pt
2617,news,news,por favor informe-me quando houver uma actualização na noticia sobre a queda do avião,pt
7988,calendar,calendar,o que está previsto acontecer amanhã à noite,pt
5348,iot,iot,dê-me luzes suaves,pt
13096,qa,qa,quantos oceanos há no mundo,pt
8389,calendar,calendar,lembrar-me na segunda-feira às duas da tarde para marcar uma reunião com o andré,pt
13590,qa,qa,qual a temperatura actual em nova york,pt
2878,alarm,alarm,por favor cancela todos os alarmes para amanhã,pt
10428,lists,lists,elimina a minha lista de compras,pt
2290,iot,iot,ligar a máquina de café para fazer um café de filtro em dez minutos,pt
13664,qa,qa,diz me factos sobre o estádio do benfica,pt
16704,email,email,eu recebi algum email nas últimas duas horas,pt
4038,takeaway,takeaway,pede pizza da telepizza,pt
10476,lists,lists,remover gato da sorte da minha lista de compras,pt
14257,qa,qa,mostrar taxa de conversão do dólar americano para a rupia indiana,pt
10601,lists,lists,acho que fiquei sem isto podes juntar isto à minha lista,pt
16331,email,email,transcrever o conteúdo do email,pt
13260,qa,qa,listar as celebridades que estiveram no meu país nos últimos cinco anos,pt
10469,lists,lists,pode criar uma lista nova na lista de reprodução,pt
2964,play,play,toca todas as músicas do pedro abrunhosa por favor,pt
13169,recommendation,recommendation,que restaurante tem o arroz de marisco mais barato,pt
6244,general,general,hoje tive um dia relaxante,pt
13577,general,general,como é que ela faz a sua maquilhagem,pt
6206,general,general,o dia de hoje foi muito cansativo,pt
3781,play,play,queria ouvir a playlist que criei para o meu casamento,pt
6862,calendar,calendar,informar me sobre os meus próximos eventos,pt
10065,cooking,cooking,que especiarias se encontram na comida indiana,pt
450,iot,iot,alexa fazer café,pt
6021,general,general,qual é a última piada,pt
14575,qa,qa,qual moeda usa-se na inglaterra,pt
5197,iot,iot,posso beber uma chávena de café,pt
5437,news,news,quais sãos as notícias do jornal de lisboa,pt
6971,calendar,calendar,cancela o evento,pt
4769,iot,iot,desligar a ficha da tomada da shelly,pt
9159,calendar,calendar,olly crie um evento no meu calendário,pt
948,music,music,gosto da música de fundo,pt
11037,lists,lists,remover mãe da minha lista de contactos,pt
13733,qa,qa,qual o preço da acção da ford,pt
9295,play,play,abre a r. f. m.,pt
11116,lists,lists,adicionar novos artigos à lista de alarmes,pt
1506,iot,iot,liga a ficha wemo,pt
12929,transport,transport,acede ao g. p. s. para me guiar por favor,pt
1394,datetime,datetime,que horas são agora,pt
8286,calendar,calendar,tenho alguma festa marcada para esta semana,pt
5729,iot,iot,desliga a luz,pt
12164,transport,transport,compra um bilhete de comboio para o meu pai,pt
330,audio,audio,mais baixo,pt
16660,email,email,que foi a última pessoa a enviar-me um e-mail,pt
14262,qa,qa,qual é definição de enredo,pt
15351,social,social,contactar o leo,pt
15529,social,social,tuitar serviço ao cliente da google que seus produtos são inferiores,pt
5512,alarm,alarm,ligar o meu alarme,pt
1701,iot,iot,ligar o meu aspirador robot entre as dez e as onze da manhã diariamente,pt
10659,lists,lists,apaga o artigo quatro,pt
7226,calendar,calendar,relembra me a reunião com os diretores na próxima semana,pt
84,iot,iot,ligar o aspirador robot,pt
9557,play,play,qual é o programa com a maior escolha de espetadores na televisão,pt
2785,iot,iot,começa a aspirar,pt
1463,news,news,notificar-me sobre actualização da nigeria,pt
14851,qa,qa,qual o resultado de cem menos cinquenta,pt
12786,transport,transport,a que horas é que chega o comboio,pt
7453,calendar,calendar,adicionar um evento ao meu calendário,pt
932,music,music,por favor guarda esta música,pt
17055,email,email,adicionar um novo email nos meus contactos para joão,pt
2045,iot,iot,a lux está demasiado,pt
6474,weather,weather,como está o tempo,pt
14832,qa,qa,qual é a fortuna da celebridade,pt
433,weather,weather,quão quente está agora lá fora,pt
12243,transport,transport,reserve um táxi para amanhã de manhã,pt
557,alarm,alarm,quanto alarmes estão na lista,pt
787,weather,weather,como está o tempo hoje,pt
12223,transport,transport,como está o transito olly,pt
8734,calendar,calendar,que lembretes tenho hoje,pt
9731,play,play,reproduz o código da vinci,pt
3239,iot,iot,por favor desligue todas as luzes na casa,pt
5345,iot,iot,fazer um pote de café forte,pt
15992,email,email,envie um email para arnaldo queiroz sobre meus melhores desejos e anexe um trabalho em pdf,pt
893,play,play,toca música agora,pt
2866,takeaway,takeaway,vê por favor se o indiano entrega ao domicílio,pt
2648,music,music,por favor verifica a minha playlist para música jazz,pt
1263,alarm,alarm,quantos alarmes tenho,pt
9652,play,play,olly abre o netflix na minha p. s. quatro,pt
10862,lists,lists,preciso de retirar este estabelecimento da minha lista,pt
5716,play,play,coloque a lista de músicas em ordem se cantor primeiro arijit singh música depois sukhwinder depois sunidhi,pt
1767,datetime,datetime,converte vinte e três horas e trinta de g. m. t. mais quatro horas e trinta em g. m. t. mais duas horas,pt
5864,news,news,dê-me as últimas novidades sobre o marcelo rebelo de sousa,pt
3549,play,play,toca marco paulo em modo aleatório,pt
5467,weather,weather,vão ser precisos óculos de sol,pt
6329,general,general,há certas partes do meu dia onde eu me estou exausto olly,pt
715,news,news,dê-me um jornal,pt
6033,iot,iot,fazer um sumo feliz,pt
3567,datetime,datetime,qual é a data atual na índia,pt
17160,email,email,guarda os meus contactos,pt
14538,qa,qa,explica me sobre o rock,pt
7933,calendar,calendar,marcar qualquer compromisso para este evento no meu calendário,pt
29,iot,iot,aspirar a casa olly,pt
7018,calendar,calendar,apagar véspera de ano novo do calendário,pt
12658,transport,transport,como eu saiu da minha casa para o alvo em quarenta minutos,pt
16287,email,email,enviar um email de aniversário para o meu patrão,pt
11170,lists,lists,fornece esta lista,pt
5077,weather,weather,parece frio,pt
4750,weather,weather,vai nevar,pt
10575,lists,lists,remover miguel sousa da lista de contactos,pt
13528,qa,qa,pode listar o top dez de singles esta semana,pt
17109,email,email,adicionar albano arroba gmail ponto com à minha lista de contactos,pt
1376,iot,iot,por favor apagar a luz da casa de banho,pt
16939,email,email,responder com a minha morada para o joão,pt
1296,news,news,receber as notícias sobre a reunião de hoje,pt
7082,calendar,calendar,preciso de um lembrete para a reunião das dezasseis horas,pt
4350,datetime,datetime,que horas são em lisboa,pt
1838,play,play,melhor diogo piçarra músicas,pt
16552,email,email,existem emails não lidos no gmail,pt
12599,transport,transport,qual é o mais longo para uma localização,pt
13153,qa,qa,que prémios o bruno nogueira ganhou ontem à noite,pt
4734,alarm,alarm,programar o alarme para as nove da manhã nos fins-de-semana,pt
7818,calendar,calendar,eu tenho reunião amanhã,pt
604,weather,weather,como vai estar o tempo daqui a uma semana,pt
6631,general,general,o que achas do ventura,pt
3685,play,play,toca a minha playlist de música latina por favor,pt
9774,play,play,põe audiolivro onde o deixei,pt
7708,alarm,alarm,define um alarme para o encontro de amanhã às sete da manhã,pt
9393,play,play,ei olly liga o rádio,pt
11457,play,play,passa para o próximo episódio deste podcast,pt
12494,transport,transport,chama um uber para mim,pt
3891,play,play,volta atrás,pt
8082,calendar,calendar,a hora que a reunião começa,pt
5008,weather,weather,vou precisar de casaco esta tarde,pt
507,alarm,alarm,corrigir a hora do alarme,pt
9139,calendar,calendar,ei por favor providenciar informação sobre eventos no final do dia,pt
6854,calendar,calendar,deleta o próximo evento no calendário,pt
11308,play,play,quero ouvir um novo podcast acerca de saúde,pt
6739,calendar,calendar,tenho reunião com o sérgio esta semana,pt
566,weather,weather,qual é a temperatura,pt
14426,qa,qa,o produto que investi está aumentando,pt
6264,general,general,estou de mau humor diz-me uma piada,pt
3069,takeaway,takeaway,manda vir alguma comida chinesa,pt
1983,alarm,alarm,accionar o alarme a meia hora da minha hora de refeição,pt
10873,lists,lists,eliminar lista de compras,pt
11848,recommendation,recommendation,que eventos estão a acontecer hoje,pt
15316,social,social,minha irmã acabou de ter o seu bebé,pt
17145,email,email,abrir emails,pt
231,takeaway,takeaway,podes ajudar-me a pedir sushi na uber eats por favor,pt
10514,lists,lists,quero fazer a lista de afazeres da próxima semana,pt
2105,music,music,eu gosto de qualquer coisa do tiago nacarato,pt
14265,qa,qa,onde fica o oceano ártico,pt
16088,email,email,dar uma atualização de última hora sobre emails recebidos por favor,pt
1752,play,play,toca todas as músicas de madredeus,pt
15571,social,social,tweet reclamação ao dominos,pt
9987,cooking,cooking,congelante,pt
10474,lists,lists,eu tenho alguma coisa na lista,pt
16610,email,email,preciso ver se tenho algum novo email,pt
10332,play,play,abrir subway surfers,pt
3007,iot,iot,alexa aumentar as luzes,pt
6740,calendar,calendar,quando é o aniversário do pedro,pt
3798,iot,iot,mudar as cores da luz,pt
14716,qa,qa,qual o preço da taxa cambial da tata neste momento,pt
13600,qa,qa,a minha ação aumentou de valor,pt
7656,calendar,calendar,alexa lê a lista de tarefas de hoje,pt
2938,play,play,toca a minha playlist mais recente,pt
15211,social,social,publicar um post no instagram,pt
9100,calendar,calendar,doze de fevereiro consulta no médico,pt
7589,calendar,calendar,tenho um lembrete,pt
7527,calendar,calendar,no dia vinte e três de março tenho de ir ao encontro da minha tia,pt
10713,lists,lists,alexa cria uma lista nova,pt
8852,calendar,calendar,eliminar a próxima tarefa,pt
10800,lists,lists,apaga a lista recente agora,pt
6769,calendar,calendar,dispensar meu próximo evento,pt
530,iot,iot,por sensor remoto,pt
1957,general,general,olly diz-me os meus lembretes,pt
16977,email,email,por favor encontrar número de contacto do joão vilela,pt
5769,takeaway,takeaway,há um takeaway no restaurante habanero,pt
14318,qa,qa,qual é a mais alta cadeia montanhosa dos eua,pt
7114,calendar,calendar,diz-me se há alguma reunião da cidade segunda-feira,pt
16274,email,email,actualizar caixa de entrada do email,pt
14805,qa,qa,quando é o aniversário da madonna,pt
8115,calendar,calendar,entre um de maio e trinta e um de dezembro que reuniões ocorreram,pt
10158,cooking,cooking,pode dizer-me como cozinhar bolachas com pepitas de chocolate,pt
7812,calendar,calendar,lembrar-me na noite anterior da minha consulta no dentista,pt
13657,qa,qa,quanto é que o elton john paga pelos seus fatos,pt
8614,calendar,calendar,agendar evento para todas as quartas feiras,pt
8348,calendar,calendar,diz me o que vai acontecer na próxima quinta feira,pt
1795,datetime,datetime,qual a data de hoje,pt
14960,qa,qa,o jogar de futebol com a melhor classificação de sempre,pt
2224,weather,weather,tempo no porto,pt
8737,calendar,calendar,apagar minha agenda para a data,pt
9810,play,play,por favor põe o álbum do marco paulo,pt
13351,qa,qa,o que significa esta palavra,pt
11315,play,play,por favor põe o podcast das manhãs da comercial,pt
12782,transport,transport,mostra-me as direções para o museu da marinha em lisboa,pt
1229,news,news,encontra me as últimas notícias sobre política,pt
12849,transport,transport,chama-me um uber para belver,pt
1598,iot,iot,ligar o rowenta robot,pt
1918,weather,weather,como será o tempo nos próximos sete dias,pt
3358,news,news,mantenha-me informado sobre o protesto dos camionistas,pt
6757,calendar,calendar,põe lembrete para ligar ao pedro amanhã,pt
9510,play,play,define a frequência do rádio,pt
16226,email,email,editar contactos,pt
15260,social,social,atualiza o meus estado informando que recebi uma promoção,pt
12443,transport,transport,será que consigo voltar para casa sem engarrafamento,pt
5995,weather,weather,vou ter de usar o meu impermeável hoje,pt
1248,datetime,datetime,podes dizer me a data de hoje,pt
6396,general,general,qual foi a pergunta mais estúpida que alguém já te perguntou,pt
16690,email,email,responder ao novo do joaquim,pt
7053,calendar,calendar,que eventos estão programados para a próxima terça-feira entre as onze horas da manhã e as quinze horas,pt
13814,qa,qa,o que é um grelhador weber,pt
10481,lists,lists,repassa a minha lista de tarefas comigo,pt
12678,transport,transport,há viagens para o local feitas por comboio,pt
8172,calendar,calendar,pode me lembrar da próxima consulta no dentista um dia antes,pt
4122,alarm,alarm,diz-me qual a hora do alarme,pt
8176,calendar,calendar,podes marcar uma reunião com o joão na próxima segunda-feira às seis da tarde,pt
1670,news,news,facebook lança alertas de contestação para reprimir notícias falsas,pt
16382,email,email,o pai mandou algum email recentemente,pt
105,news,news,quais são as notícias no canal da s. i. c.,pt
10258,play,play,vamos jogar,pt
7472,alarm,alarm,programar o alarme no dia dez de novembro para o relógio,pt
5576,datetime,datetime,data de hoje,pt
12316,transport,transport,me dê informações sobre o transito próximo a minha localização por favor,pt
11229,lists,lists,tenho todas as informações sobre os p. d. a.,pt
1275,iot,iot,fazer um bom café,pt
15009,qa,qa,quanto custa a acção do walmart,pt
13445,qa,qa,com quem é jennifer aniston casada,pt
9782,play,play,toca a daqui a cinco minutos,pt
9883,play,play,voltar a ensaio sobre a cegueira,pt
1672,play,play,todas as músicas lançadas entre mil novecentos e noventa e dois mil serão as únicas a serem tocadas,pt
7408,calendar,calendar,definir um evento feliz aniversário joão para repetir a vinte e um de janeiro de dois mil e dezassete,pt
5633,play,play,toca uma música da artista aurea,pt
12659,transport,transport,dá-me as direções para o mcdonalds na segunda circular,pt
15724,social,social,tweet a portugália que meu último voo de chicago para londres foi adiado,pt
1873,music,music,alexa excelente música para o caminho,pt
14607,general,general,ok google o que aconteceu à ruth marlene,pt
16352,email,email,algum email recente,pt
9376,play,play,liga o rádio,pt
9055,calendar,calendar,criar um lembrete de um evento para uma reunião com a mona na terça-feira,pt
2051,weather,weather,diz me a previsão de tempo de hoje para a cidade de coimbra,pt
6153,weather,weather,diz-me sobre o estado atual do tempo,pt
12698,transport,transport,qual é o último comboio que parte da marinha grande leiria,pt
5473,datetime,datetime,quantos domingos tem este mês,pt
11454,play,play,põe o próximo podcast,pt
12496,transport,transport,olly ligue para o uber em trinta minutos,pt
15068,qa,qa,onde está lozalizado o monte rushmore,pt
4092,audio,audio,retira o som das colunas por um minuto preciso de fazer uma chamada,pt
4295,play,play,toca ruth marlene por favor,pt
836,news,news,quais são as últimas fofocas de holywood,pt
5639,datetime,datetime,qual é a data de hoje,pt
15925,email,email,enviar email a família,pt
17007,email,email,tenho alguns novos emails na minha caixa de entrada,pt
7923,calendar,calendar,a que horas é a minha reunião,pt
11380,play,play,toque para mim noventa segundos de ciência,pt
1556,weather,weather,por favor dá me a previsão de tempo para esta semana,pt
670,takeaway,takeaway,encomende uma pizza,pt
11390,play,play,posso ver o próximo episódio do podcast por favor,pt
8675,calendar,calendar,quem virá à minha reunião às nove da manhã,pt
16181,email,email,enviar um email à bruna quero encontrar-me com ela amanhã às quatorze horas,pt
3640,news,news,mostre-me as notícias da c. n. n.,pt
16039,email,email,olá olly o joão enviu-me algum email recentemente,pt
5049,iot,iot,todos os botões no painel de controlo ligados,pt
13289,qa,qa,define perpétuo,pt
10591,lists,lists,remover o cabeçalho da lista,pt
9995,cooking,cooking,quanto tempo leve a água a ferver,pt
3120,datetime,datetime,se está doze horas à frente do horário oriental que horas são agora nas filipinas,pt
12036,recommendation,recommendation,por favor diz me uma loja onde possa encontrar livros para comprar,pt
8040,calendar,calendar,pode lembrar me de algo em algum momento,pt
3240,iot,iot,mudar a cor da luz para vermelho fora da casa,pt
8573,calendar,calendar,abrir o calendário e criar um novo evento,pt
1482,iot,iot,você consegue deixar a luz um tom avermelhado na sala de estar,pt
7491,calendar,calendar,adicionar lembrete hoje à noite para recolher o pacote do josé no porto,pt
14447,qa,qa,qual é a renda per capita média entre as pessoas da ásia e da europa,pt
17050,email,email,atualizar email,pt
5931,news,news,eu preciso das mais recentes notícias do yahoo,pt
4856,audio,audio,silencia o volume,pt
14776,qa,qa,alexa quais são preços das acções amd,pt
9417,play,play,sintoniza na r. f. m.,pt
13751,qa,qa,taxa de câmbio atual,pt
5656,play,play,põe a tocar música do michael jackson,pt
12996,general,general,preciso de verificar a pressão dos meus pneus,pt
7423,calendar,calendar,reunião esta segunda feira,pt
1602,play,play,toca uma lista de músicas do avatar,pt
5972,alarm,alarm,poderia por favor remover os alarmes programados entre oito e nove,pt
7321,calendar,calendar,que eventos vão acontecer na minha cidade entre as duas e quatro da tarde de hoje,pt
11533,play,play,podes saltar para o próximo episódio,pt
5335,alarm,alarm,há alarmes definidos,pt
10897,lists,lists,olly remove o artigo da minha lista,pt
12751,transport,transport,compra um bilhete de comboio de lisboa a bragança para daqui a uma semana,pt
12060,recommendation,recommendation,eu desejo ir fazer compras baratas há alguma loja dos chineses por perto,pt
941,alarm,alarm,define o meu alarme por favor,pt
13726,qa,qa,onde a torre de belém está localizada,pt
14363,general,general,o que tem sido o produto mais vendido na categoria de desporto na amazon nos últimos três dias,pt
5144,weather,weather,por favor diz me que dia será chuvoso baseado na previsão to tempo,pt
745,news,news,o que é tendência,pt
2070,audio,audio,desliga a coluna,pt
16251,email,email,alexa fornecer informações sobre o bruno a partir da minha lista de contactos,pt
1721,alarm,alarm,programar o alarme das dez da manhã a semana toda no mês de abril,pt
7419,calendar,calendar,encontro com a família esta segunda-feira,pt
12946,qa,qa,quão alto é micheal jackson,pt
13213,general,general,quantos baldes cheios seriam necessários para esvaziar o mar morto,pt
248,news,news,olly people ware,pt
11991,recommendation,recommendation,mostrar quais lojas tem ao redor de mim,pt
11960,recommendation,recommendation,onde é que eu posso ir às compras aqui perto,pt
10473,lists,lists,eu preciso de fazer uma lista de afazeres para o trabalho,pt
3219,alarm,alarm,define um alarme para amanhã às seis da manhã,pt
15394,social,social,reclamação para i. m. t. t. sobre a fila excessivamente longa,pt
4372,play,play,quero ouvir a minha música favorita,pt
13326,general,general,qual é o horário do continente,pt
14892,qa,qa,quantos fãs é que essa pessoa tem aproximadamente,pt
3655,music,music,podes dizer me mais sobre a minha música mais tocada,pt
497,iot,iot,confirmar se a cor é azul,pt
5235,weather,weather,guarda chuva mais tarde,pt
16464,email,email,salvar esse email como um novo contacto,pt
13883,qa,qa,google o preço das acções da i. b. m.,pt
11425,play,play,vai para a minha lista favorita,pt
15071,qa,qa,conceber os compostos químicos necessários para criar açúcar que não cause diabetes ou aumento de peso mas que não tenha um sabor químico,pt
6676,news,news,poluição do ar,pt
15347,social,social,existem algumas novas notícias veganas no facebook,pt
15793,email,email,qual é o cargo do xavier almeida,pt
5482,audio,audio,olly baixa o volume,pt
15159,social,social,posso saber o que é mais popular no facebook,pt
6251,general,general,adivinha o que aconteceu hoje,pt
3747,news,news,google avisa-me quando houver novidades sobre marcelo rebelo de sousa,pt
204,alarm,alarm,tenho algum alarme,pt
14136,general,general,por favor explica o enredo do filme titanic,pt
16508,email,email,adicionar novo contacto e enviar e-mail,pt
1003,alarm,alarm,remove o meu alarme para amanhã de manhã,pt
4380,takeaway,takeaway,o capa negra oferece takeaway,pt
8352,calendar,calendar,por favor assinalar no calendário terapia todas as terças feiras às onze da manhã,pt
15641,social,social,tweet uma queixa sobre a cor do meu sapato do seaside,pt
7460,calendar,calendar,o evento do calendário tem várias pessoas,pt
11803,recommendation,recommendation,vai haver algum mercado local na zona este fim de semana,pt
824,weather,weather,ok google qual é o tempo para onde estou hoje,pt
15774,email,email,diz-me o número fixo,pt
10491,lists,lists,não tocar mais a lista antiga,pt
15026,qa,qa,o que é uma noite em paris,pt
577,play,play,tocar problema de expressão na clã rádio,pt
4074,iot,iot,ligar o meu aspirador robot,pt
7998,calendar,calendar,apagar o meu próximo evento,pt
9533,play,play,começa a tocar a noventa e seis ponto cinco f. m. quando for uma da tarde,pt
8643,calendar,calendar,qual é o cronograma para esta data,pt
2310,iot,iot,diminuir as luzes para sete,pt
14966,qa,qa,quanto custa a empresa nestlé,pt
13068,qa,qa,o que significa a palavra laranja,pt
14729,qa,qa,quanto é vinte pesos argentinos em libras,pt
6664,general,general,olá o que estás a fazer,pt
6354,general,general,como te tens sentido ultimamente,pt
6781,calendar,calendar,a que horas é a minha consulta médica esta semana,pt
12958,qa,qa,explique o que significa p. i. b.,pt
1958,news,news,mostra as noticias mais recentes,pt
3857,weather,weather,vai estar de chuva esta semana,pt
