id,label,label_text,text,lang
10606,lists,lists,quantos produtos alimentares constam da lista,pt
7033,alarm,alarm,programar um lembrete para o meu encontro com o agente esta noite,pt
16076,email,email,mostre recentes emails do rui para o olly,pt
7770,calendar,calendar,tenho alguns lembretes definidos,pt
16482,email,email,ler o email de mãe incluindo o assunto,pt
11251,lists,lists,olly lê-me a lista de mercearias,pt
3529,play,play,põe uma playlist de música de festa,pt
16122,email,email,criar novo email para a emilia,pt
13302,general,general,qual seria uma refeição perfeitamente balanceada nutricionalmente para jantar,pt
6735,calendar,calendar,alexa cancela todos os eventos do próximos dois dias,pt
4539,email,email,não queria que enviasse esse texto mas que esperasse até que eu dissesse para enviar,pt
2327,weather,weather,que temperatura está,pt
7642,weather,weather,mostre me a previsão do tempo para os próximos três dias,pt
15729,social,social,a meo é péssima escrever esta mensagem na conta deles no twitter,pt
12998,general,general,podes dizer-me a solução para resolver as alterações climáticas,pt
14109,qa,qa,qual foi o primeiro presidente dos estados unidos da américa,pt
9879,play,play,deixa me ouvir alguma música pop ou uma canção,pt
10989,lists,lists,retirar pimentos vermelhos das mercearias,pt
571,datetime,datetime,o natal é dia vinte e dois,pt
16262,email,email,verifique a minha caixa de entrada para quaisquer novos emails de roberto,pt
12795,transport,transport,siri quanto custa um bilhete de comboio,pt
8632,calendar,calendar,você pode remover isso do meu calendário,pt
6745,calendar,calendar,adiciona ao meu calendário chamada diária para as cinco da tarde,pt
8743,calendar,calendar,exclua o próximo evento do meu calendário para que eu não o veja novamente,pt
4190,music,music,quem está a tocar o oboé nesta peça,pt
6154,datetime,datetime,que data é na próxima segunda-feira,pt
5620,play,play,toque essa música a meia noite,pt
16598,email,email,responder sim a isto,pt
458,audio,audio,podes falar mais alto,pt
12836,transport,transport,quais são os horários dos comboios,pt
958,iot,iot,pedir esta tecnologia,pt
12551,transport,transport,como é que vou de onde estou para o aquashow em quarteira,pt
11449,play,play,tocar o último podcast da madalena vidigal,pt
15712,social,social,quero fazer uma reclamação ao consumidor,pt
9544,play,play,põe a tocar amor combate no rádio do carro,pt
1792,general,general,boa tarde como estás,pt
4789,weather,weather,qual é o tempo para hoje,pt
7011,calendar,calendar,adicionar uma reunião com o joão moreira no meu calendário e,pt
5331,datetime,datetime,fuso horário entre portugal e os estados unidos da américa,pt
3122,weather,weather,o que devo usar está frio lá fora,pt
6766,calendar,calendar,lembra me de ir ao ginásio toda segunda feira e terça feira,pt
7746,calendar,calendar,estou de férias esta semana,pt
11982,recommendation,recommendation,olly que filmes estão em exibição na alvaláxia,pt
15677,social,social,por favor abrir minha aplicação twitter e encontrar a secção de reclamação para padaria portuguesa,pt
16092,email,email,qualquer novo email depois das cinco da tarde,pt
4878,alarm,alarm,troca o meu alarme das nove da noite por um às cinco da manhã,pt
8330,calendar,calendar,lembrar-me da reunião de hoje às quatro da tarde,pt
2815,iot,iot,girar as luzes da sala de estar para um por cento,pt
14801,general,general,como é que resolveste o problema,pt
16700,email,email,ir ao meu gmail e clicar em compôr quando terminar vou dizer-lhe o que quero escrever no e-mail,pt
7525,calendar,calendar,o que o rui tem a dizer sobre o casamento quando me encontrar hoje,pt
6524,general,general,como comer saudável,pt
6587,general,general,hoje caí no trabalho,pt
3227,datetime,datetime,qual a data de amanhã,pt
6332,general,general,hoje recebi uma encomenda no correio,pt
4873,music,music,avaliação,pt
11176,lists,lists,adiciona um nome de um filme à minha lista de desejos,pt
10122,cooking,cooking,qual é uma boa receita de taco,pt
10151,cooking,cooking,encontra-me a receita para um bolo,pt
11846,recommendation,recommendation,diz me eventos interessantes nas docas,pt
3284,weather,weather,como está o tempo no porto,pt
17044,email,email,escreve um email ao roberto,pt
9649,play,play,vai ao spotify e toca a rádio de hip hop,pt
2138,play,play,toca jazz,pt
14439,qa,qa,busque pela taxa de câmbio do dólar,pt
14294,qa,qa,explicar a taxa de câmbio de rupias por dólar,pt
278,weather,weather,qual é o tempo no porto,pt
10777,lists,lists,eu tenho alguma lista da amazon guardada,pt
11898,recommendation,recommendation,algum festival na cidade no momento ou na próxima semana,pt
11924,recommendation,recommendation,por favor encontra a loja mais popular na área,pt
6007,weather,weather,devo fechar a a janela antes de sair esta tarde,pt
5129,play,play,toca a playlist um,pt
4141,news,news,olá olly dá-me as principais notícias de hoje,pt
16395,email,email,sobre o quê e quem foi-me enviado um email na semana passada,pt
15222,social,social,publicar um comentário no facebook,pt
3366,news,news,ir para c. n. n. ponto com,pt
335,weather,weather,gostaria de saber o tempo no porto,pt
13803,qa,qa,qual é o rio mais longo do mundo,pt
6200,general,general,como é que é possível,pt
6215,general,general,hoje foi demasiado ocupado,pt
3071,audio,audio,podes tirar o som,pt
8689,calendar,calendar,colocar um jantar com a minha irmã no sábado,pt
13593,qa,qa,quantos gramas são uma chávena de manteiga,pt
3808,iot,iot,aumentar as luzes,pt
1164,play,play,toca amar pelos dois de salvador sobral,pt
10584,lists,lists,ei coloca cenouras ali,pt
7942,calendar,calendar,diz-me o que vai acontecer amanhã,pt
4458,news,news,notícias locais do mundo,pt
8019,calendar,calendar,reseva esta tarde para o meu encontro,pt
12738,transport,transport,caminho rápido para chegar a casa,pt
5412,news,news,quais são as notícias no jornal i hoje,pt
3709,music,music,quando é que esta música foi gravada pela primeira vez,pt
9938,cooking,cooking,quanto tempo devo cozinhar um hambúrguer de cada lado,pt
5029,news,news,dá-me as noticias,pt
5603,play,play,toca a playlist mp do início,pt
11649,recommendation,recommendation,há algum carnaval a acontecer hoje na zona,pt
1091,iot,iot,tornar a sala mais clara,pt
1937,weather,weather,diz me o tempo para o porto,pt
2129,iot,iot,mudar iluminação da casa de verde para vermelho,pt
12889,transport,transport,eu posso pegar um uber para casa saindo do centro o mais rápido possível,pt
8898,calendar,calendar,informação,pt
17110,email,email,atualizar os meus contactos com o novo contacto selma arroba gmail ponto com,pt
9469,play,play,sintoniza a rádio local,pt
5780,datetime,datetime,data e hora,pt
11031,lists,lists,tenho alguma coisa na minha lista de afazeres para o meu companheiro,pt
9056,calendar,calendar,alexa criar um lembrete para uma reunião com a mónica na terça-feira,pt
8454,calendar,calendar,adicionar ao meu calendário para hoje jorge brito à uma da tarde,pt
14623,qa,qa,informações sobre celebridades,pt
2524,takeaway,takeaway,posso pedir para entregarem,pt
10425,lists,lists,lista os itens na minha lista de compras,pt
14486,qa,qa,quanto vale um dólar canadense nos estados unidos,pt
13543,general,general,diz-me como fazer uma chave de parafusos por favor,pt
13388,qa,qa,qual é a taxa de conversão atual de dolar para euro,pt
6624,general,general,namorar,pt
9604,play,play,quero que ponhas rádio a dar,pt
14797,qa,qa,qual a informação sobre as acções do continente,pt
3905,alarm,alarm,o futebol acabou não preciso mais do alarme para o futebol para quarta-feira à noite,pt
9102,calendar,calendar,tenho alguma coisa agendada para a uma da tarde da próxima segunda feira,pt
9537,play,play,liga a rádio noventa e três pronto oito f. m. por favor,pt
3425,iot,iot,pode preparar-me um café agora,pt
16,iot,iot,alexa diminui as luzes no salão,pt
7802,calendar,calendar,abre os meus lembretes,pt
15235,social,social,olá google publica o meu estado atual no twitter que indica uma grande viagem a paris com amigos e família,pt
13398,qa,qa,o que vai ser a cura do cancro,pt
273,music,music,qual é esta música,pt
9877,play,play,gostaria de ouvir o meu audiolivro,pt
13394,calendar,calendar,quero marcar consultas médicas entre outras coisas para mim,pt
15050,qa,qa,olá qual a definição de receita,pt
14914,qa,qa,qual é a montanha mais alta em portugal,pt
5798,news,news,telemóvel do modelo iphone,pt
5668,alarm,alarm,depois toca em ok,pt
11056,lists,lists,o que tenho que para fazer hoje,pt
581,iot,iot,desligar o candeeiro,pt
7002,calendar,calendar,programar um evento no calendário para repetir anualmente nesta deta,pt
1171,play,play,toca a minha playlist,pt
9050,calendar,calendar,adicionar casamento da mónica até no meu calendário para terça feira,pt
11632,recommendation,recommendation,por favor diz me onde posso beber um copo aqui perto depois da meia noite,pt
5700,weather,weather,posso secar minhas roupas no varal,pt
9711,play,play,avança rápido o áudio e depois retoma,pt
12614,transport,transport,compra um bilhete de comboio intercidades de lisboa ao porto,pt
5607,iot,iot,mais luz,pt
4110,iot,iot,ligar a minha tomada inteligente,pt
9407,play,play,toca rádio renascença,pt
9416,play,play,põe o podcast mais recente das manhãs da comercial,pt
7142,calendar,calendar,o que é nessa data,pt
15206,social,social,informar a atualização do facebook a cada três horas,pt
7358,calendar,calendar,enumerar todos os eventos do meu calendário de março,pt
9020,calendar,calendar,reuniões da primeira semana de março,pt
6207,general,general,hoje tive um mau da,pt
3703,alarm,alarm,que alarmes estão definidos para esta semana,pt
568,weather,weather,quão frio está,pt
11432,play,play,podes pôr o podcast de tomatojuicecom,pt
16853,email,email,emails do antónio silva,pt
3073,audio,audio,tira o volume,pt
14977,qa,qa,ajude-me a descobrir os antecedentes de morgan freeman,pt
10971,lists,lists,adiciona lápis a minha lista de material escolar,pt
2107,play,play,cordas e pianos mas apenas guitarra acústica não elétrica por favor,pt
9753,play,play,olly podes reproduzir os lusíadas,pt
12445,transport,transport,mostra-me os horários dos comboios para braga amanhã,pt
9998,qa,qa,o que cria leitelho,pt
5032,audio,audio,podes aumentar o volume,pt
1299,audio,audio,devagar,pt
464,datetime,datetime,diz me a data e hora,pt
8911,calendar,calendar,o que é que eu tenho na agenda hoje das doze horas às quatorze horas,pt
10867,lists,lists,listar me o lembrete das coisas que restam na lista,pt
13728,qa,qa,distância até o marco local,pt
11910,recommendation,recommendation,olly diz me eventos fixes a acontecer aqui,pt
7597,calendar,calendar,por favor marcar o habitual evento reunião para as nossas viagens de negócios,pt
12662,recommendation,recommendation,que serviços de comboio há perto de mim,pt
339,iot,iot,preciso de um café agora,pt
8560,calendar,calendar,tenho algo para mais tarde,pt
13176,general,general,encontra eventos recentes de celebridades,pt
14956,qa,qa,abrir mapa,pt
5210,alarm,alarm,que alarmes tenho definidos para hoje,pt
1820,iot,iot,ligar o aspirador robot,pt
5530,news,news,notificação sobre as novas políticas governamentais,pt
2393,music,music,qual é o nome desta música,pt
1562,iot,iot,está escuro aqui aumentar a luminosidade das luzes,pt
6987,calendar,calendar,lembra-me do aniversário do meu tio joão todos os dias quatro de maio por favor,pt
8799,calendar,calendar,podes dizer-me quando tenho de pagar o seguro do carro,pt
160,iot,iot,diminui as luzes,pt
14310,qa,qa,o que compõe uma cabeça de xara,pt
805,audio,audio,ok google retira todo o volume às colunas,pt
2348,music,music,diz me o nível de volume na música atual,pt
13671,qa,qa,que é actualmente a pessoa viva mais velha do mundo,pt
11213,lists,lists,adicionar a música à nova lista de reprodução,pt
1708,audio,audio,muda o volume da coluna para sessenta e cinco por cento,pt
10372,play,play,jogar temple runner,pt
1286,datetime,datetime,que horas serão agora no porto,pt
10437,lists,lists,por favor cria uma lista nova,pt
7787,calendar,calendar,lembrete para a noite anterior à minha consulta consulta médica,pt
14980,qa,qa,descrição do iphone sete,pt
13862,qa,qa,que forma tem uma bola,pt
12111,recommendation,recommendation,encontra um evento que dê para crianças na minha zona esta noite,pt
2063,weather,weather,diz me o tempo para esta semana,pt
8529,weather,weather,dá me o tempo para o porto às quinze horas,pt
4393,takeaway,takeaway,por favor peça pizza e asinhas do pizzaria lisboa agora,pt
12151,transport,transport,reserve para mim um bilhete para paris na eurostar este fim de semana,pt
1436,alarm,alarm,que alarmes tenho,pt
10201,cooking,cooking,quais os passos para uma refeição de biryani,pt
16390,email,email,que emails não lidos tenho,pt
15386,social,social,postar a foto que acabei de tirar no twitter,pt
8738,calendar,calendar,apaga o evento do calendário,pt
5238,news,news,mostrar as últimas notícias sobre migração,pt
2180,datetime,datetime,horas por favor,pt
9386,play,play,preciso que encontres boas estações para ouvir,pt
16108,email,email,qual é o número de casa da manuela,pt
14141,qa,qa,qual é a taxa de câmbio entre a libra esterlina e o dólar dos e. u. a.,pt
8485,calendar,calendar,a que horas começa a reunião com a galp na sexta-feira,pt
3639,news,news,obter notícias da b. b. c.,pt
8544,calendar,calendar,limpar todos os eventos do meu calendário,pt
16576,email,email,o joão já me enviou uma resposta por email,pt
11811,recommendation,recommendation,o que está em exibição no coliseu do porto,pt
10144,cooking,cooking,quanto tempo devo deixar no frio uma tarte gelada,pt
15926,email,email,enviar um email a rui dizendo-lhe que o meu telefone voltou a funcionar,pt
13295,general,general,qual é a receita para bolachas de chocolate,pt
960,iot,iot,aumenta as luzes,pt
13287,general,general,dá me a definição de inflação e diz o quão importante é para qualquer economia,pt
10315,play,play,vamos jogar ao verdade ou consequência,pt
4535,news,news,quais são as principais notícias do diário de notícias,pt
3939,music,music,podes guardar esta música nos meus favoritos,pt
8139,calendar,calendar,é quinta feira amanhã,pt
10675,lists,lists,diga-me algo interessante na lista de mensagens,pt
12404,transport,transport,a que horas é que o comboio onde estamos chega à próxima estação,pt
1240,play,play,spotify,pt
888,datetime,datetime,que data é hoje,pt
268,iot,iot,tornar as luzes mais brilhantes,pt
5000,play,play,põe haja o que houver em seguida,pt
10668,lists,lists,fala-me sobre a lista,pt
16031,email,email,olly abra um novo email a este colega de trabalho neste email,pt
8275,calendar,calendar,por favor eliminar aniversário do jerónimo do calendário,pt
4743,alarm,alarm,google diz-me que alarmes tenho programados,pt
7457,calendar,calendar,remarcar a reunião para as seis da tarde de amanhã e informar os membros,pt
15976,email,email,adicionar rita gomes à minha lista de contactos favoritos,pt
6032,audio,audio,controlo de volume,pt
16747,email,email,o miguel enviou algum email,pt
15118,qa,qa,por favor verificar as tendências recentes nas acções,pt
12304,transport,transport,horários do comboio para lisboa,pt
2945,iot,iot,desliga candeeiro sala de estar,pt
11746,recommendation,recommendation,olly que filmes vão passar esta noite às vinte e uma horas no monumental,pt
16963,email,email,ler email e enviar para membros da família,pt
8792,calendar,calendar,quias são os detalhes para este evento,pt
14392,qa,qa,define aceleração,pt
12990,qa,qa,qual é a população por milha quadrada mais baixa em áfrica,pt
16388,email,email,ei olly eu tenho algum email do bruno sobre bulldog,pt
4229,iot,iot,podes desligar o candeeiro do meu quarto,pt
3188,news,news,o que é a nova política de imigração de donald trump,pt
13719,qa,qa,vai a adele sair em uma turnê,pt
3396,music,music,esta música está no top vinte,pt
3422,music,music,quem canta,pt
186,play,play,toque a última música da minha lista de reprodução preferida,pt
9650,play,play,quero ouvir o programa da cidade f. m.,pt
2457,datetime,datetime,horário g. m. t.,pt
4340,takeaway,takeaway,mostra-me restaurantes chineses perto de mim,pt
14724,qa,qa,ajuda microfone,pt
5710,weather,weather,vou precisar de protetor solar esta tarde,pt
432,weather,weather,qual é o tempo lá fora agora,pt
10147,cooking,cooking,procura receitas de omelete de queijo com quatro queijos,pt
8232,calendar,calendar,não estou a fazer nada esta semana,pt
12209,transport,transport,há algum acidente na cidade universitária,pt
4395,audio,audio,por favor fala mais alto,pt
8663,recommendation,recommendation,que eventos estão a acontecer em braga nesta semana,pt
10064,cooking,cooking,quantos legumes devo comer por dia,pt
16720,email,email,o número de casa do guilherme está nos meus contactos,pt
5315,news,news,o que está a acontecer agora no mundo checar em b. b. c.,pt
15901,email,email,qual é o número de telefone do nuno,pt
3902,play,play,iniciar o feed de música de fado,pt
10820,lists,lists,o que está na minha lista hoje,pt
930,music,music,repete esta música,pt
13415,recommendation,recommendation,diz-me qual o melhor lugar para ir,pt
8368,calendar,calendar,agendar a minha reunião o tom cruise hoje à seis da tarde,pt
14718,qa,qa,posso ter uma lista de cotações das ações da ola e uber,pt
16138,email,email,mostrar todos os emails recebidos recentemente,pt
12763,transport,transport,preciso de um bilhete de comboio para,pt
652,iot,iot,desligar as luzes da sala,pt
12778,transport,transport,reserva um táxi,pt
15505,social,social,tuitar serviço ao cliente da meo e dizer lhes eu estive em espera durante meia hora,pt
7010,calendar,calendar,envia uma compromisso no calendário à joana,pt
8167,calendar,calendar,criar no calendário reunião com senhora catarina na quarta-feira às oito da manhã,pt
11726,recommendation,recommendation,faz uma reserva para dois na canastra do fidalgo,pt
10161,cooking,cooking,o que é que acompanha vinho de arroz,pt
11684,recommendation,recommendation,gostaria de saber de eventos acontecendo próximos daqui,pt
8550,calendar,calendar,as horas a que é a festa das férias no escritório,pt
9888,play,play,continua onde deixei o cálice de fogo,pt
2874,play,play,toca música rap por faovr,pt
2212,music,music,repete a música,pt
11249,lists,lists,adere a isto,pt
15787,email,email,tenho algum email do trabalho,pt
16757,email,email,tenho algum novo email,pt
6855,alarm,alarm,definir um alarme para amanhã às dez da manhã com o nome reunião,pt
5093,datetime,datetime,as horas,pt
11686,recommendation,recommendation,por favor actualiza me com a lista de eventos a acontecer na minha área,pt
14362,qa,qa,quais são as chances de o mercado de ações fechar abaixo da média móvel de duzentos nos próximos quatorze dias,pt
5185,news,news,existe alguma notícia actual sobre a eleição presidencial,pt
3157,alarm,alarm,se a minha encomenda está para entrega amanhã definir um alarme uma hora depois,pt
15669,social,social,escrever tweet de reclamação,pt
6606,recommendation,recommendation,filmes no top dez,pt
16429,email,email,envia um email à minha mãe a dizer que estarei presente na próxima semana,pt
342,iot,iot,prepara uma chávena de café,pt
11769,recommendation,recommendation,podes dizer me uma lista de eventos para este fim de semana em paranhos,pt
244,news,news,o que está a acontecer em coimbra,pt
11465,play,play,continua para o próximo podcast,pt
11793,recommendation,recommendation,eu preciso de um bom filme romântico alguma sugestão,pt
2700,play,play,toca música rock,pt
6869,calendar,calendar,pode sincronizar o meu calendário com o marco,pt
13586,qa,qa,donald trump tem alguma ligação com a rússia,pt
8155,calendar,calendar,reunião julie quinze horas quarta-feira,pt
6583,general,general,vamos começar amigo,pt
14514,qa,qa,qual é o presidente atual dos estados unidos,pt
16858,email,email,emails na última hora,pt
10740,lists,lists,há espaço na minha lista de mantimentos para um item extra,pt
5153,music,music,por favor repete a última música,pt
11893,recommendation,recommendation,há algum evento a acontecer este fim de semana,pt
2645,iot,iot,diminuir as luzes na sala comum,pt
11405,play,play,selecciona o próximo episódio no podcast por favor,pt
3657,music,music,que música eu prefiro,pt
2880,audio,audio,aumenta o volume para setenta por cento,pt
17130,email,email,envie um email para a mãe com o assunto férias,pt
9548,play,play,por favor ligar uma das estações memorizadas,pt
17163,email,email,enviar mail de alerta para sandra,pt
9464,play,play,reproduz o programa dr. saúde no meu telemóvel,pt
10937,lists,lists,limpar lista de coisas a fazer este fim de semana,pt
16587,email,email,verificar se há novos emails google,pt
1704,datetime,datetime,que horas são,pt
15255,social,social,alguém me pode explicar o que vocês estão a discutir,pt
17014,email,email,responder ao email,pt
6223,general,general,o meu dia foi stressante,pt
3964,alarm,alarm,quantos alarmes estão definidos,pt
6846,calendar,calendar,lembrar de enviar e-mail para a minha irmã,pt
9207,play,play,olly liga o rádio,pt
12113,recommendation,recommendation,algum mercado agrícola por perto com produtos locais,pt
6233,general,general,olly hoje conheci a minha futura mulher por favor marca um encontro para a próxima sexta feira,pt
3579,audio,audio,silencia-te até às quinze horas,pt
558,alarm,alarm,tenho algum alarme definido para amanhã,pt
7265,calendar,calendar,mostra a minha agenda,pt
1604,alarm,alarm,para que horas está definido o alarme amanhã de manhã,pt
2319,iot,iot,diminuir a iluminação,pt
3648,weather,weather,como está o tempo no porto,pt
2019,iot,iot,alternar as luzes entre azul verde e amarelo,pt
7869,calendar,calendar,remover evento do calendário,pt
3327,news,news,mostra-me as noticias,pt
6910,calendar,calendar,o que eu tenho programado para às próximas três horas,pt
6702,weather,weather,tempo hoje,pt
8840,calendar,calendar,a que horas está marcado o próximo evento,pt
12184,transport,transport,há alguma zona em obras na nacional dois,pt
12503,transport,transport,quando parte o próximo comboio para a baixa do porto,pt
998,iot,iot,desligar as luzes neste quarto,pt
569,datetime,datetime,quantos aniversários calham no dia vinte e três,pt
6450,general,general,quando é a previsão do primeiro de dia de setenta graus,pt
4153,play,play,põe a música eu tenho dois amores,pt
13696,general,general,fala me sobre esta pessoa,pt
9429,play,play,põe o jogo de futsal da faculdade,pt
2650,news,news,quais são as notícias locais da manhã de hoje,pt
10074,cooking,cooking,quanto tempo se cozinha um ovo mal cozido,pt
16760,email,email,dá-me os meus emails por favor,pt
5689,news,news,mostra-me as noticias mais recentes,pt
14948,qa,qa,olly descreve o que é um círculo de colheita,pt
3949,alarm,alarm,podes definir um alarme,pt
3504,weather,weather,qual é o tempo no porto hoje,pt
3921,play,play,por favor põe música feita nesta década,pt
6727,calendar,calendar,remover conversa com o alberto,pt
11951,recommendation,recommendation,diz me restaurantes bem classificados nesta zona,pt
4370,audio,audio,aumenta o volume para nível sete no leitor de música,pt
15835,email,email,responde ao meu email mais recente,pt
5913,music,music,diz me o nome do compositor,pt
2333,alarm,alarm,define um alarme para amanhã às seis da manhã,pt
12167,transport,transport,como está o trânsito na avenida liberdade,pt
6706,general,general,a inteligência artificial tem consciência,pt
40,general,general,cheque o desempenho da minha bateria,pt
16906,email,email,envia um email à minha família a perguntar como estão,pt
12356,transport,transport,preciso de um bilhete de comboio,pt
4437,weather,weather,posso usar sandálias,pt
7072,calendar,calendar,enviar-me uma notificação uma hora antes dos meus próximos eventos do calendário,pt
16905,email,email,enviar um email à minha família contando-lhes sobre os meus planos para o próximo aniversário,pt
5002,iot,iot,aumentar o brilho da luz,pt
7416,calendar,calendar,repetir o lembrete para as minhas marcações no natal,pt
16136,email,email,verificar e-mail e qual é o assunto mais recente,pt
7789,calendar,calendar,não me deixes esquecer de ligar ao alex,pt
1706,iot,iot,por favor desligar a luz do lado direito,pt
12549,transport,transport,direções para vila real,pt
721,alarm,alarm,cria um alarme para amanhã às quatro horas da manhã,pt
11830,recommendation,recommendation,onde posso comprar equipamento desportivo perto de mim,pt
3172,iot,iot,baixar a intensidade das luzes,pt
653,play,play,procura alguma música gospel,pt
9346,play,play,toca esta estação de rádio,pt
12428,transport,transport,preciso de um táxi agora mesmo,pt
4812,datetime,datetime,dia vinte e dois é que dia,pt
5327,play,play,procura por música por favor,pt
912,play,play,põe a dar a minha estação favorita na pandora,pt
3356,music,music,eu adoro música africana,pt
15752,email,email,encontrar todos os mails da magda com a palavra feriados no título,pt
10739,lists,lists,quero saber se pode um item extra ser adicionado à minha lista de mercearias,pt
14896,qa,qa,onde foi rama em sua última jornada,pt
75,music,music,qual é o autor desta música,pt
3226,play,play,quero ouvir a música um,pt
14964,qa,qa,alexa o que é google,pt
15820,email,email,muda o email da mãe na minha lista de contactos,pt
135,takeaway,takeaway,situação da entrega da telepizza,pt
3638,play,play,põe haja o que houver de madredeus,pt
14401,general,general,diz-me qual foi a última que te pedi para pesquisar,pt
12462,transport,transport,reserva um uber para esta noite às sete horas,pt
1049,audio,audio,muda as definições do som,pt
8982,calendar,calendar,apague minha consulta com eduardo,pt
