id,label,label_text,text,lang
15781,email,email,hei google skicka e post till karolin hur har du det skicka en projektuppdatering till mig tack hasse,sv
6738,general,general,jag tar ledigt imorgon,sv
326,weather,weather,kväll,sv
3509,iot,iot,släck lamporna i köket,sv
11105,lists,lists,att göra lista,sv
12237,transport,transport,boka taxi för nu,sv
9063,calendar,calendar,lägg till leas födelsedag i kalendern den tjugoandra juni,sv
7307,calendar,calendar,rensa alla event den här månaden,sv
10134,cooking,cooking,hitta ett recept för thailändskt stekt ris,sv
5509,general,general,ge mig ett skämt,sv
13918,qa,qa,vad är en högtryckstvätt,sv
7337,calendar,calendar,vad är på min kalender imorgon,sv
11641,recommendation,recommendation,vad händer häromkring,sv
3892,audio,audio,tyst läge på en gång,sv
14965,qa,qa,vad är den aktuella kursen för assa abloy aktie,sv
7135,calendar,calendar,boka ett möte för imorgon,sv
4128,alarm,alarm,har jag för närvarande några larm,sv
340,iot,iot,jag hjälpte en fattig person i dag olly,sv
6218,general,general,jag gick till mataffären idag,sv
4019,datetime,datetime,när är nästa ledighet,sv
12556,transport,transport,hur lång tid tar det att åka till jobbet,sv
6896,calendar,calendar,lägg till tid hos min tandläkare tio på morgonen nästa måndag,sv
10502,lists,lists,jag behöver lägga till pasta och mjölk i inköpslistan,sv
6814,calendar,calendar,ola påminn mig min mammas födelsedag en vecka i förväg,sv
10113,cooking,cooking,hur lagar man en god burgare olly,sv
10705,lists,lists,kolla anteckningar appen och ge mig information om alla listor,sv
36,general,general,kolla om min bil är redo,sv
3544,iot,iot,kan det här rummet ha grönt ljus,sv
6941,calendar,calendar,kom ihåg att påminna mig om kundmöte klockan sexton,sv
6375,music,music,olly vad är ett bra rap album som kom ut i år,sv
10330,play,play,låt oss spela checkers,sv
16800,email,email,är där några mejl från katrina om tom,sv
15650,social,social,vilka har skrivit till mig eller nämnt mig i sociala medier,sv
95,alarm,alarm,sätt ett larm åtta varje vardag,sv
17008,email,email,har jag fått några mejl på senaste tiden,sv
3278,iot,iot,dämpa lamporna i mitt sovrum,sv
11748,recommendation,recommendation,vad händer i jönköping,sv
7600,calendar,calendar,har jag några evenemang på gång nästa vecka,sv
9954,cooking,cooking,vilken temperatur borde en bakad kyckling vara,sv
3739,news,news,visa mig dagens världs nyheter,sv
9306,play,play,sätt på radio station åt mig,sv
3079,music,music,kan du ta fram information om sångaren i den här låten,sv
6167,audio,audio,inga notifikationer för fem minuter,sv
2362,takeaway,takeaway,hitta närmaste kinarestaurangen som har hämtmat,sv
7190,calendar,calendar,vad har jag i kalendern idag,sv
12830,transport,transport,boka en taxi till mig via taxikurir,sv
17000,email,email,visa mina senaste mejl,sv
13360,qa,qa,vad betyder besatt,sv
13240,general,general,vad är det genomsnittliga priset på ett hus i halland,sv
10829,lists,lists,vad kommer härnest på min lista,sv
16782,email,email,kan du skicka e post till mamma om veckans väder,sv
12562,transport,transport,hitta en tågbiljett till stockholm den fjortonde april,sv
872,iot,iot,släck lampan i sovrummet,sv
1142,datetime,datetime,säg mig vilken veckodag det är,sv
8340,calendar,calendar,rensa mitt nästa event,sv
12959,general,general,förklara hur danmarks sociala status skiljer sig från den i norge nu och förr,sv
13065,general,general,jag kör snälla svara mina samtal med högtalartelefon,sv
5089,news,news,siri vad har hänt i nyheterna idag,sv
16420,email,email,kolla olästa mejl,sv
4382,weather,weather,hur är vädret nästa vecka i malmö skåne,sv
2984,alarm,alarm,ta bort schemalagt alarm,sv
3180,alarm,alarm,jag skulle vilja ha ett larm satt för denna lördagen vid tio,sv
11966,recommendation,recommendation,var finns det en bra restaurant,sv
6016,news,news,har guvernören antagit det nya brottsförslaget än,sv
12434,transport,transport,hitta mig ett tåg till bohus,sv
2331,weather,weather,hur är vädret just nu,sv
6750,calendar,calendar,vad är härnäst på mitt schema,sv
5124,weather,weather,är det varmt eller kallt ute,sv
5430,weather,weather,kommer det att vara kallt nog för vantar senare inatt,sv
12780,transport,transport,begär en uber nu,sv
15339,social,social,skicka det här meddelandet till twitter,sv
6257,general,general,hej är det här första gången du är här,sv
13838,qa,qa,kan du hjälpa mig att hitta svaret på den här frågan,sv
8108,calendar,calendar,ta bort nästa evenemang i kalender,sv
14369,general,general,är det man eller kvinna,sv
6698,general,general,hej olly jag fick sparken idag,sv
1720,alarm,alarm,ställ in alarmet varje tisdag i mars månad på morgonen klockan åtta,sv
3730,news,news,berätta för mig det senaste om lottningen av i. f. k. göteborg,sv
5223,news,news,vad är de senaste nyheterna om stefan löfven,sv
2096,takeaway,takeaway,har peking garden onlinebeställning,sv
13581,qa,qa,vilka vulkaner ur aktiva just nu,sv
14990,weather,weather,ange vädret i vår stad,sv
7829,calendar,calendar,vad annat finns på listan,sv
1828,news,news,ge mig några stornyheter i göteborg,sv
12188,transport,transport,hur är trafiken i centrala city,sv
9786,play,play,spela min bok,sv
4015,alarm,alarm,ta bort mitt väcknings alarm,sv
14167,qa,qa,rowan atkinson information,sv
1330,music,music,vad heter den här låten,sv
735,audio,audio,kan du sänka din volym tack,sv
12657,transport,transport,boka en taxi till johan lund vid gate fyra på flygplatsen för det ankommande flyget flyg femtiotvå klockan sju på fredag,sv
13542,iot,iot,starta ugnen,sv
14432,qa,qa,hur många yen per u. s. d. idag,sv
5844,weather,weather,borde jag använda solkräm idag,sv
12061,transport,transport,hur långt borta är clas olsson från här,sv
3691,weather,weather,vad är den nuvarande temperaturen i stockholm,sv
15931,email,email,låt mig veta när ett nytt mejl kommer från rosa,sv
14480,general,general,berätta hastigheten för att ta sig till solen,sv
139,play,play,spela min jazz spellista,sv
6847,alarm,alarm,sätt ett larm på onsdag vid lunchtid så att jag kan registrera för program för tidiga användare,sv
15144,social,social,få statusen publicerad för följande,sv
1326,takeaway,takeaway,tillåter den restaurangen beställningar för avhämtning,sv
14242,qa,qa,vad heter han,sv
6349,general,general,hej vad händer,sv
7203,calendar,calendar,vilka evenemang jag har inplanerade kommande två veckorna,sv
2398,play,play,börja celine dion musik,sv
11462,play,play,sätt på elaine eksvärds podcast,sv
11683,recommendation,recommendation,visa mig var jag kan hitta en burgare,sv
16080,email,email,mejla min mamma,sv
4628,weather,weather,vilken tid kommer det regna imorgon,sv
11925,recommendation,recommendation,hitta cafe nära centrala borås,sv
4562,datetime,datetime,alexa kan du konvertera min tidszon till den tidszon jag är i just nu,sv
8628,calendar,calendar,påminn mig varje dag klockan fem på morgonen,sv
13833,qa,qa,hur många kronor finns i en dollar,sv
3830,alarm,alarm,jag behöver inte längre det dagliga larmet vid sjutton noll noll,sv
736,audio,audio,kan du vara snäll och ropa ut svaret till mig,sv
2958,iot,iot,starta robotdammsugaren,sv
16741,email,email,checka min mejl för den senaste timmen,sv
7799,calendar,calendar,visa mig nyligen tillagda händelser,sv
10639,lists,lists,vilka saker behöver jag till min resa,sv
8465,calendar,calendar,skicka mig notifikation om möte onsdag nio på morgonen,sv
5418,general,general,någonting jag behöver veta,sv
2080,alarm,alarm,är mitt väckningsalarm sex på morgonen,sv
11518,play,play,gå tillbaka till nästa avsnitt av skavlan podcast,sv
15058,qa,qa,berätta va ordet pil betyder,sv
3367,news,news,vad är dagens nyheters rubrik,sv
13589,qa,qa,snälla berätta vad en vevaxel är,sv
2760,play,play,börja spela musik,sv
3017,takeaway,takeaway,har kinarestaurangen hemkörning,sv
11897,recommendation,recommendation,händer det någonting i stan denna helgen,sv
8197,calendar,calendar,har jag några väntande påminnelser,sv
7698,calendar,calendar,påminn mig i framtiden om detta,sv
2155,datetime,datetime,vad är klockan just nu,sv
7807,calendar,calendar,låt mig inte glömma att jag har föräldramöte denna måndag vid fyra på eftermiddagen,sv
16783,email,email,min mamma behöver sin väderprognos skicka den till henne,sv
7497,calendar,calendar,är födelsedagsmiddagen i kalendern på fredag,sv
17122,email,email,vänligen starta ett mejl till min syster,sv
2099,takeaway,takeaway,leta fram rosegarden på nätet,sv
11167,lists,lists,lägg till mjölk i min shoppinglista,sv
1728,weather,weather,bekräfta vädret den trettonde den här månaden tack,sv
5162,alarm,alarm,jag vill vakna sex på morgonen,sv
2632,datetime,datetime,låt mig veta dagens datum i amerikanskt format,sv
13709,qa,qa,hur långt bort är skärgården i stockholm,sv
12865,transport,transport,kan du berätta tågens tider för mig som går till falun från örebro,sv
6641,general,general,memo,sv
7895,calendar,calendar,ge mig en uppdatering om valet imorgon vid tolv,sv
7795,calendar,calendar,var är tisdagens morgon möte,sv
3519,iot,iot,kan vi skruva upp ljuset,sv
7634,calendar,calendar,de kommande tre söndagarna påminn mig att jag har yogaklass vid tolv,sv
7884,calendar,calendar,ola sätt möte klockan nitton noll noll,sv
2521,news,news,visa mig vad som händer,sv
3350,audio,audio,var brinner det,sv
13990,qa,qa,var är ashwin,sv
4204,weather,weather,kommer det att vara snö den här veckan,sv
7473,calendar,calendar,påminn mig om mötet med min lärare idag klockan fem,sv
4592,alarm,alarm,vilka larm kommer,sv
12472,transport,transport,betala för tågbiljett,sv
6081,weather,weather,behöver jag en kappa idag,sv
2661,iot,iot,släck lamporna i köket,sv
10974,lists,lists,sätt på skärmen listorna jag har tillgängliga,sv
14201,qa,qa,olly vad kostar en google aktie,sv
9076,calendar,calendar,ge mig schemat,sv
7992,calendar,calendar,skriv i min kalender att jag har ett event nästa fredag,sv
2961,music,music,upprepa alla,sv
4895,news,news,sport huvudnyheter tack,sv
2727,iot,iot,stäng av wemo uttaget,sv
6930,calendar,calendar,jag vill lägga till en händelse i min kalender,sv
17024,email,email,skicka ett mejl till mamma och ta reda på hur vädret är för veckan,sv
13497,qa,qa,definiera ord,sv
3126,general,general,alexa hur många stormar har det varit den här månaden,sv
7657,calendar,calendar,ge mig min att-göra-lista för idag,sv
9508,play,play,skanna radion för howard stern,sv
4864,weather,weather,berätta om vädret i göteborg,sv
1384,datetime,datetime,vilket datum är det den tredje fredagen denna månad,sv
13090,general,general,hitta mig en bra vin affär som har gamla viner som är äldre än tio år navigera mig till den butiken,sv
4635,audio,audio,skruva ner högtalar volym,sv
11012,lists,lists,vad är härnäst på min lista av möten,sv
13675,qa,qa,vad är den aktuella aktiekursen för latour,sv
4260,audio,audio,skruva upp volym,sv
11159,lists,lists,ta bort sötpotatis,sv
9157,calendar,calendar,larma,sv
16102,email,email,skicka ett mejl till min chef om min ledighet,sv
12642,transport,transport,jag behöver åka med tåget fem på eftermiddagen till stockholm,sv
5092,music,music,siri skippa två låtar,sv
38,general,general,er ljusstyrkan på min skärm låg,sv
15253,social,social,vilka vänner var på trendiga ställen igår,sv
7267,calendar,calendar,hej se till att jag går till annas födelsedagsfest den tolfte,sv
4989,music,music,vilken spellista är på shuffle,sv
16681,email,email,skicka mejl till janne hej jag saknade dig igår vill du gå ut på middag ikväll,sv
14561,general,general,vilka saker gör en kvinna lycklig,sv
4517,takeaway,takeaway,kolla statusen på min beställning,sv
16941,email,email,genom outlook,sv
11038,lists,lists,ta bort fjäril hårspänne från min önskelista,sv
3256,general,general,ge mig det senaste du har anna björk,sv
16740,email,email,vilka mejl har jag fått sedan igår kväll,sv
4901,audio,audio,skruva ner media volym,sv
1441,play,play,spela alla indie pop låtar,sv
973,news,news,vad är de senaste nyheterna,sv
10042,cooking,cooking,var kan jag hitta receptet för magic cookie bars,sv
2078,audio,audio,skruva ner volymen lite tack,sv
5945,calendar,calendar,påminn min vän att hämta uppgiften imorgon,sv
12271,transport,transport,kan du boka mig en tågbiljett till motala för i morgon med något tåg,sv
16439,email,email,där är ett mejl jag behöver att du skickar till min vän,sv
5928,iot,iot,sätt på kaffebryggaren och börja brygga,sv
13557,qa,qa,vad är huvudstaden i estland,sv
8178,calendar,calendar,kan du bjuda in nilsson för ett möte nästa måndag vid sex på kvällen,sv
7507,calendar,calendar,hur många möten är det i min kalender idag,sv
1950,news,news,några toppnyheter,sv
8166,calendar,calendar,vänligen lägg till mötet med larsson på onsdag åtta på morgonen till min kalender,sv
7581,calendar,calendar,lista mitt dagens möte,sv
13831,qa,qa,hur stort är towern,sv
7063,calendar,calendar,ta bort alla mina evenemang,sv
2618,news,news,lägg till en notis från borås nyheter om vädret,sv
8567,calendar,calendar,schemalägg brunch vid tio på morgonen och bjud in linn och ebba tack,sv
11956,recommendation,recommendation,olly vilka filmer visas nära mig,sv
10900,lists,lists,hjälp mig att skapa en lista,sv
9564,play,play,starta radio på max volym som alarm på morgonen,sv
15416,social,social,tweeta otrevlig personal,sv
11492,play,play,spela min spellista dansbandsfavoriter,sv
6800,calendar,calendar,har jag något möte imorgon bitti,sv
6510,email,email,mejl,sv
8428,calendar,calendar,ola lägg till lunchmöte med lisa den andra januari klockan tolv och trettio,sv
16093,email,email,snälla meddela mig om eventuella inkommande mejl den senaste timmen,sv
6704,general,general,tänker du på dagen du ska återvinnas,sv
12819,transport,transport,kan du boka en biljett till falun med tåg,sv
7285,calendar,calendar,radera alla kommande yogapass,sv
14799,qa,qa,vad heter huvudstaden i tanzania,sv
7297,calendar,calendar,ta min kalender och rensa den,sv
16675,email,email,mejla joejoe på gmail punkt kom,sv
1269,news,news,vad händer i världen just nu,sv
14941,qa,qa,öppna miniräknare,sv
1824,music,music,jag gillar låtar från,sv
13820,qa,qa,är princessan diana fortfarande vid liv,sv
10314,play,play,låt oss spela fruit ninja tillsammans,sv
7584,calendar,calendar,var god kolla din kalender jag har gjort nånting,sv
14472,qa,qa,prestationer av miss li,sv
9699,play,play,starta ljudboken våroffer från där jag slutade,sv
10574,calendar,calendar,har jag några uppgifter idag,sv
3866,news,news,kan du ge mig nyheterna från borås tidning,sv
12283,transport,transport,när ska tåget till stockholm komma,sv
16169,email,email,öppna emejl med olästa mail,sv
7347,calendar,calendar,den tolfte juli är linas födelsedag och min kalender ska uppdateras med detta datum,sv
959,iot,iot,robot via blåtand aktiverade enheter,sv
6853,calendar,calendar,gå till nästa händelse i kalendern och radera den,sv
13525,general,general,jag skulle vilja att den hjälper till med kodningsfelsökning,sv
14951,qa,qa,starta internet,sv
8054,calendar,calendar,rensa alla händelser från sjunde mars,sv
10650,lists,lists,vilka listor har jag,sv
10737,calendar,calendar,vad finns på agendan för idag,sv
16555,email,email,vilken gata bor sara på kolla min telefonbok,sv
12269,transport,transport,kommer post från borlänge fram i tid i malmö,sv
7443,calendar,calendar,vilka ska gå på festen,sv
17022,email,email,alexa mejla mamma och fråga hur vädret är där,sv
7716,calendar,calendar,lägg till en födelsedagsfest med niklas larsson och anna i min kalender,sv
12973,qa,qa,vad är kanadas finansiella kapital,sv
8306,calendar,calendar,påminn mig om middag med mamma ikväll i min kalender,sv
775,news,news,meddela mig när trump är i nyheterna,sv
7389,calendar,calendar,var god radera middags dejt bokad denna fredag klockan tjugoett noll noll,sv
4788,music,music,vad är i min musik favoriter mapp,sv
11100,lists,lists,lägg till detta i min lista,sv
5562,news,news,vad är nyhetsrubrikerna,sv
9046,calendar,calendar,för veckan runt den tjugonde ta bort alla handledningsevent,sv
8711,calendar,calendar,kolla min kalender för idag,sv
667,iot,iot,minska ljusstyrkan,sv
2067,news,news,vann någon på triss igår,sv
7862,calendar,calendar,jag ska på hov ett konserten i karlstad den tjugofjärde mars,sv
1444,audio,audio,tystnad,sv
7050,calendar,calendar,google kalender lägg till event för den tjugoförsta mars,sv
3557,play,play,spela min yoga spellista,sv
971,news,news,vad är nytt idag,sv
5415,takeaway,takeaway,beställ en stor pizza till mig utan något på från pizza hut,sv
9917,cooking,cooking,vad behöver man för att laga pizza,sv
17180,email,email,kolla mejl från johan,sv
7160,calendar,calendar,påminn om detta efter två dagar,sv
16387,email,email,öppna alla olästa mejl,sv
12638,transport,transport,kolla tåg tabellen för onsdag klockan sjutton till tranås,sv
8963,calendar,calendar,lägg in min födelsedag i kalender,sv
11534,play,play,börja spela upp nästa avsnitt,sv
13251,general,general,vad är min astrologirapport för idag,sv
16645,email,email,har jag ett nummer för jerry,sv
12876,transport,transport,ring taxi stockholm och beställ en taxi för klockan tre imorgon bitti,sv
15003,qa,qa,vilket år gick avicii bort,sv
12649,transport,transport,hur är trafiken idag,sv
12143,transport,transport,vad är trafiken,sv
11737,qa,qa,olly hur många stjärnor har ondskan fått på i. m. d. b.,sv
1882,audio,audio,jag kan inte höra nånting,sv
16310,email,email,snälla svara,sv
8740,alarm,alarm,ställ in larm klockan två på eftermiddagen,sv
15823,email,email,fick jag något nytt från min chef,sv
11210,lists,lists,skapa en ny lista,sv
13598,qa,qa,vad är aktiepriset för den här artikeln,sv
8897,calendar,calendar,ta bort alla mina tidsbokningar för idag,sv
14678,qa,qa,ge mig börsens öppningspris på sonys aktier,sv
16793,email,email,vänligen ange ämnesraderna för de senaste tjugo mottagna mejlen,sv
6098,play,play,hej google spela populära hip hop låtar,sv
15978,email,email,lägg till sarah som mejl kontakt,sv
445,music,music,upprepa album,sv
15637,social,social,tweeta pizza hut att deras leverans är en timme sen,sv
11637,recommendation,recommendation,säg mig filmen med bästa i. m. d. b. rankingen som visas på biografer nära mig,sv
13531,qa,qa,hej vad betyder hetsa,sv
12449,transport,transport,hur är trafiken idag,sv
5916,iot,iot,gör en cappuccino åt mig nu,sv
12773,transport,transport,influx,sv
10443,lists,lists,ta bort händelser från min lista,sv
11766,recommendation,recommendation,säkerhetsmedvetenhet,sv
17070,email,email,har jag ett nytt mejl från sandra,sv
8021,calendar,calendar,jag behöver en påminnelse för fredagens möte,sv
8523,calendar,calendar,skapa en ny händelse i min kalender,sv
4270,iot,iot,jag skulle vilja ha en kopp kaffe,sv
8574,calendar,calendar,är jag upptagen idag,sv
6724,calendar,calendar,vad är min agenda för resten av veckan,sv
16921,email,email,aktuella mejl,sv
10414,play,play,jag vill spela schack med dig,sv
1424,news,news,ge mig nyheter om hur valet går,sv
3827,music,music,berätta för mig vilken låt som spelas nu,sv
9045,alarm,alarm,alarm sjutton tisdag,sv
2379,news,news,vad hände nyligen i världen,sv
1456,weather,weather,hur är det ute,sv
8438,general,general,berätta mer om kulturnatten,sv
14024,qa,qa,beskriv döden,sv
12081,recommendation,recommendation,kolla in rockkonserter denna helgen,sv
13334,qa,qa,tio plus y,sv
5205,play,play,sätt på higher,sv
6299,general,general,olly jag är trött,sv
6415,calendar,calendar,mina kommande evenemang,sv
11754,recommendation,recommendation,rekommendera ett blue grass bands evenemang inom tjugo kilometer från malmö skåne denna veckan,sv
17066,email,email,svara på mejlet från mattias,sv
9232,play,play,byt till stationen hundrasju komma fem power hit radio,sv
15044,qa,qa,hur mycket är en sandvik aktie värd,sv
4434,weather,weather,vad är prognosen för den här veckan,sv
6043,play,play,spela nästa låt av mina utvalda,sv
1951,datetime,datetime,vad är klockan i london,sv
10225,cooking,cooking,det borde kryddas,sv
7586,calendar,calendar,lägg till event i kalender,sv
8682,calendar,calendar,radera händelser,sv
4682,weather,weather,är det hett eller kvavt och varmt och fuktigt i sjön idag,sv
9809,play,play,snälla spela michael jacksons album,sv
5800,weather,weather,kommer jag behöva en jacka efter tio på kvällen i mitt område,sv
5589,weather,weather,hitta väderrapport,sv
2262,iot,iot,gör en med kontrast,sv
5705,play,play,låtmig lyssna på min spellista med topp rock låtar,sv
2722,general,general,vet du några bra skämt,sv
15852,email,email,läs mejl om ämne kemi,sv
13362,qa,qa,vad är kokpunkten för vatten,sv
1497,play,play,jag skulle vilja lyssna på celine dion,sv
2629,takeaway,takeaway,beställ mcdonalds,sv
14962,qa,qa,öppna aktier,sv
2440,music,music,datum när låt spelades,sv
10671,lists,lists,ta bort listan av apps som började med bokstaven a,sv
2150,music,music,ge mig information om den här låten,sv
11997,recommendation,recommendation,vilka händelserär nära mig,sv
13911,qa,qa,är michael jackson verkligen död,sv
9791,play,play,spela ljudboken the melody song,sv
3090,datetime,datetime,vilken tid är det i stillahavstid,sv
14843,qa,qa,hur definierar man tyfon,sv
2947,iot,iot,alexa stäng av wemo uttaget i köket,sv
6767,calendar,calendar,påminn mig om att shoppa varje vecka,sv
3653,datetime,datetime,vad är klockan i luleå sverige,sv
865,iot,iot,robot gör hela huset nu,sv
2260,play,play,spela gyllene tiders musik,sv
13086,qa,qa,hur stavas ordet diskant,sv
12331,transport,transport,olly boka mig en tåg biljett till vetlanda den tredje jag bryr mig inte vilken tid,sv
1128,play,play,spela det senaste albumet på en loop,sv
2406,music,music,lägg till låten till mina favoriter,sv
7192,calendar,calendar,ställ en påminnelse att lyckönska en vän imorgon klockan tio,sv
1650,news,news,låt mig höra de senaste affärs nyheterna,sv
13655,qa,qa,vilket är det högsta berget i amerika,sv
2137,play,play,spela rock,sv
12769,transport,transport,vad kostar en tåg biljett till stockholm,sv
8478,calendar,calendar,påminn mig om mitt möte vid fem på eftermiddagen,sv
5914,music,music,visa mig bilden på sångaren,sv
1005,play,play,spela eldkvarn från min senaste spellista,sv
3525,play,play,låt oss dansa,sv
11357,play,play,kan du söka efter dagens nyheter,sv
15764,email,email,hej vänligen svara på johans senaste mejl,sv
1779,weather,weather,är det kallt väder där,sv
238,alarm,alarm,finns det några alarm,sv
16488,email,email,några nya mejl,sv
14225,qa,qa,rappar snook fortfarande,sv
5969,play,play,spela bohemian raphsody för mig,sv
1270,news,news,vad är nyheterna,sv
4115,play,play,jag har inte hört dark tranquillity addera deras första sju album,sv
5759,weather,weather,väder nästa vecka i stockholm,sv
8007,calendar,calendar,jag har en tandläkartid på måndag morgon sant eller falskt,sv
4298,audio,audio,höj högtalar volym,sv
4450,alarm,alarm,vid vilken tid kommer mitt larm att väcka mig,sv
13901,qa,qa,beskrivningen av ängel,sv
10651,lists,lists,ge mig en lista av listor,sv
9832,play,play,fortsätt divergent där vi pausade,sv
5528,iot,iot,rensa dammet och sen slå på städaren,sv
12118,recommendation,recommendation,alexa sök efter evenemang nära mig tack,sv
16595,email,email,vidarebefordra mejl,sv
11347,play,play,gå till nästa avsnitt,sv
16594,email,email,läs mejl,sv
5960,takeaway,takeaway,några bra skräpmats alternativ,sv
3854,audio,audio,tysta högtalare tack,sv
16875,email,email,berätta riktnumret för jenny k.,sv
9229,play,play,spela översta radiokanalen,sv
13742,qa,qa,när är nästa lakers match,sv
12705,transport,transport,öppna tåg biljett app,sv
3334,iot,iot,få dammsugaren att städa rummet,sv
9991,cooking,cooking,visa mig tutorials på att laga mat,sv
3132,play,play,jag känner mig riktigt ledsen just nu kan du spela mina mest spelade. låtar som är humörhöjande,sv
13985,qa,qa,förklaring av mobilenhet,sv
6128,weather,weather,borde jag ta med vinterkängor,sv
6917,calendar,calendar,ta bort eventen,sv
16389,email,email,hitta mejl från bob om bulldogg,sv
2147,alarm,alarm,öppna alarm,sv
2422,weather,weather,hur är vädret i stockholm just nu,sv
13755,qa,qa,vad är detta,sv
5610,alarm,alarm,berätta för mig när nästa larm är inställt,sv
212,iot,iot,och lampan slår sig på,sv
5674,alarm,alarm,inaktivera larmet som är satt tjugoett trettio,sv
10253,play,play,spela bad piggies med mig,sv
16046,email,email,visa nya mejl tack,sv
9861,play,play,återuppta där jag slutade i boken på nextstory,sv
14968,general,general,varför är månen en ost,sv
11950,recommendation,recommendation,olly finns det några högt rankade restauranger i detta område,sv
3010,iot,iot,olly återställ ljuset för mig,sv
696,iot,iot,ljusa upp rummet tack,sv
13458,qa,qa,vad är sex gånger sextioåtta,sv
6150,play,play,hitta jazzmusik på min spellista,sv
3487,audio,audio,det är tyst tid,sv
4316,iot,iot,släck ner alla lamporna,sv
13237,qa,qa,vad betyder olika,sv
17033,email,email,svar på mejlet från lasse denna morgonen,sv
1491,news,news,ge mig nyheterna från dagens nyheter,sv
16411,email,email,ta upp alla mejl från min vän katarina larsson,sv
8392,calendar,calendar,möte var god ställ in påminnelse,sv
10416,play,play,ska vi spela ett spel,sv
15718,social,social,tweeta ett klagomål till n. k. angående deras butiksbiträde,sv
8644,calendar,calendar,hej olly vad är agendan för datumet,sv
6684,news,news,cricket uppdatering,sv
5564,news,news,har budgeten blivit omröstad än,sv
14433,qa,qa,hur mycket svenska kronor per euro idag,sv
