id,label,label_text,text,lang
16700,email,email,gå till min gmail och klicka på skriv när du är klar så berättar jag vad jag vill skriva i mejlet,sv
7525,calendar,calendar,vad säger johan om giftermål när han träffar mig idag,sv
6524,general,general,hur man äter hälsosamt,sv
6587,general,general,jag ramlade på jobbet idag,sv
3227,datetime,datetime,vad är det för datum imorgon,sv
6332,general,general,jag fick ett paket i posten idag,sv
4873,music,music,recension,sv
11176,lists,lists,lägg till filmnamn i min önskelista,sv
10122,cooking,cooking,vad är ett gott taco recept,sv
10151,cooking,cooking,hitta recept för en tårta åt mig,sv
11846,recommendation,recommendation,föreslå mig med några spännande evenemang runt höga kusten,sv
3284,weather,weather,hur är vädret i stockholm,sv
17044,email,email,skriv mejl för robert,sv
9649,play,play,gå till sveriges radio och spela hiphop kanalen,sv
2138,play,play,spela jazz,sv
14439,qa,qa,hitta växelkurs för svenska kronor till danska kronor,sv
14294,qa,qa,förklara växlingskursen mellan en rupie och dollar,sv
278,weather,weather,hur är vädret i göteborg,sv
10777,lists,lists,har jag en amazonlista sparad,sv
11898,recommendation,recommendation,är det några festivaler i stan just nu eller i kommande vecka,sv
11924,recommendation,recommendation,snälla hitta den mest populära butiken i närheten,sv
6007,weather,weather,borde jag stänga fönstret innan jag går ut i eftermiddag,sv
5129,play,play,spela spellista ett,sv
4141,news,news,hej olly berätta om dagens huvudnyheter,sv
16395,email,email,vad och vem mejlade jag om förra veckan,sv
15222,social,social,meddela en kommentar på facebook,sv
3366,news,news,gå till expressen punkt s. e.,sv
335,weather,weather,jag vill veta vädret i stockholm,sv
13803,qa,qa,vilken är världens längsta flod,sv
6200,general,general,hur är det möjligt,sv
6215,general,general,idag var det mycket stress,sv
3071,audio,audio,kan du tysta ljudet,sv
8689,calendar,calendar,lägg till middag med min syster på lördag,sv
13593,qa,qa,hur många gram är det i en kopp smör,sv
3808,iot,iot,skruva upp ljuset,sv
1164,play,play,spela eld och lågor me victor leksell,sv
10584,lists,lists,hej lägg till morötter till det,sv
7942,calendar,calendar,berätta vad som händer imorgon,sv
4458,news,news,lokala nyheter,sv
8019,calendar,calendar,spara den här eftermiddagen för min dejt,sv
12738,transport,transport,snabbaste vägen för att ta mig hem,sv
5412,news,news,vad händer på s. v. t. nyheter idag,sv
3709,music,music,när var denna låten först inspelad,sv
9938,cooking,cooking,hur länge borde jag steka en hamburgare på var sida,sv
5029,news,news,ge mig nyheter,sv
5603,play,play,spela m. p. spellista från början,sv
11649,recommendation,recommendation,är det en karneval här idag,sv
1091,iot,iot,gör rummet ljusare tack,sv
1937,weather,weather,ge mig väderförhållandet i stockholm,sv
2129,iot,iot,ändra lampan i huset från grön till röd,sv
12889,transport,transport,kan jag få en uber hem från söder så snart som möjligt,sv
8898,calendar,calendar,information,sv
17110,email,email,uppdatera mina kontaker med den nya kontakten stina snabel a. gmail punkt com,sv
9469,play,play,sätt på den lokala radion,sv
5780,datetime,datetime,datum och tid,sv
11031,lists,lists,har jag något på min älskling att göra lista,sv
9056,calendar,calendar,alexa skapa en händelse påminnelse möte med lisa på tisdag,sv
8454,calendar,calendar,lägg till i min kalender för idag johan nilsson klockan ett på eftermiddagen,sv
14623,qa,qa,kändis info,sv
2524,takeaway,takeaway,kan jag beställa ta med,sv
10425,lists,lists,läs upp artiklarna från min shoppinglista,sv
14486,qa,qa,hur mycket är en norsk krona värd i sverige,sv
13543,general,general,snälla berätta hur man gör en skruvmejsel,sv
13388,qa,qa,vad är den nuvarande växlingskursen för dollar till euro,sv
6624,general,general,dejting,sv
9604,play,play,jag vill att du startar radion,sv
14797,qa,qa,vad är aktieinformationen för saab,sv
3905,alarm,alarm,fotbollen är avslutad jag behöver inte längre larm för fotbollen på onsdag kväll,sv
9102,calendar,calendar,har jag något schemalagt flr ett på eftermiddagen nästa måndag,sv
9537,play,play,sätt på radio chakavak nittioett komma ett,sv
3425,iot,iot,kan du göra kaffe till mig nu,sv
16,iot,iot,olly dimma lamporna i hallen,sv
7802,calendar,calendar,öppna mina påminnelser,sv
15235,social,social,hej google lägg upp min aktuella status på twitter som nämner en fantastisk resa i paris med vänner och familj,sv
13398,qa,qa,vad kommer att vara botemedlet mot cancer,sv
273,music,music,vilken är denna låten,sv
9877,play,play,jag skulle vilja lyssna på min ljudbok,sv
13394,calendar,calendar,jag skulle vilja boka en läkartid åt mig,sv
15050,qa,qa,vad betyder recept,sv
14914,qa,qa,vad är det högsta berget i italien,sv
5798,news,news,iphone,sv
5668,alarm,alarm,klicka okej,sv
11056,lists,lists,vad jag behöver göra idag,sv
581,iot,iot,släck lampan,sv
7002,calendar,calendar,ställ in ett kalender event att upprepa årligen på det här datumet,sv
1171,play,play,spela min spellista med per gessle,sv
9050,calendar,calendar,lägg till annas bröllop till min kalender för tisdag,sv
11632,recommendation,recommendation,var snäll och berätta för mig var jag kan få en drink i närheten efter midnatt,sv
5700,weather,weather,kan jag lufttorka mina kläder ute,sv
9711,play,play,jag vill snabbspola ljudet framåt och sen återuppta,sv
12614,transport,transport,boka en tåg biljett fån stockholm till malmö,sv
5607,iot,iot,ljusare,sv
4110,iot,iot,sätt på min smartkontakt,sv
9407,play,play,spela mix megapol,sv
9416,play,play,spela den senaste podcasten om onlineundersökningar,sv
7142,calendar,calendar,vad finns på det datumet,sv
15206,social,social,var tredje timme uppdatera mig om facebook,sv
7358,calendar,calendar,lista alla event i min kalender för mars,sv
9020,calendar,calendar,möten första veckan i mars,sv
6207,general,general,jag hade en dålig dag idag,sv
3703,alarm,alarm,vilka larm är aktiverade denna veckan,sv
568,weather,weather,hur kallt är det,sv
11432,play,play,kan du spela podcasten från podcasts punkt nu,sv
16853,email,email,mejl från jenny larsson,sv
3073,audio,audio,stäng av volymen,sv
14977,qa,qa,ge mig en bakgrundshistoria om morgan freeman,sv
10971,lists,lists,lägg till penna till skolmaterialslistan,sv
2107,play,play,sträng och pianomusik men bara akustisk gitarr men inte elektrisk tack,sv
9753,play,play,olly kan du spela jakten på röda oktober,sv
12445,transport,transport,ge mig tåg tider för imorgon till stockholm,sv
9998,qa,qa,vad är kärnmjölk,sv
5032,audio,audio,kan du skruva upp volymen,sv
1299,audio,audio,långsamt,sv
464,datetime,datetime,berätta datum och tid,sv
8911,calendar,calendar,vad har jag på schema idag från tolv till två på eftermiddagen,sv
10867,lists,lists,olly läs upp de kvarvarande sakerna på listan,sv
13728,qa,qa,avstånd till lokala landmärken,sv
11910,recommendation,recommendation,olly berätta om några coola evenemang som händer här,sv
7597,calendar,calendar,vänligen arrangera det vanliga mötes evenemanget för våra affärsresor,sv
12662,recommendation,recommendation,vilka tågbolag finns nära mig,sv
339,iot,iot,yo jag behöver en kaffe nu,sv
8560,calendar,calendar,har jag något att göra senare,sv
13176,general,general,hitta senaste händelser av kändisen,sv
14956,qa,qa,öppna karta,sv
5210,alarm,alarm,vilka larm har jag aktiverade idag,sv
1820,iot,iot,starta robotstädaren,sv
5530,news,news,uppdateringar angående den nya regeringspolitiken,sv
2393,music,music,vad heter den här låten,sv
1562,iot,iot,det är mörkt här snälla höj upp ljusets intensitet,sv
6987,calendar,calendar,var god påminn mig min morbror hjalmars födelsedag varje fjärde maj,sv
8799,calendar,calendar,kan du berätta när vi måste betala bilförsäkringen,sv
160,iot,iot,dimma lamporna,sv
14310,qa,qa,vad gör något till sylta,sv
805,audio,audio,ok google sänk all volym på högtalare tack,sv
2348,music,music,visa volymstyrka på nuvarande låt,sv
13671,qa,qa,hur gammal är den äldsta personen i världen,sv
11213,lists,lists,lägg till sång nya spellistan,sv
1708,audio,audio,ändra högtalarvolymen till sextiofem procent,sv
10372,play,play,spela temple runner,sv
1286,datetime,datetime,vad är tiden nu i washington,sv
10437,lists,lists,skapa en ny lista tack,sv
7787,calendar,calendar,påminn mig kvällen innan om läkarbesöket,sv
14980,qa,qa,beskrivning av iphone sju,sv
13862,qa,qa,vilken form har en boll,sv
12111,recommendation,recommendation,hitta ett barnvänligt evenemang i mitt område för ikväll,sv
2063,weather,weather,berätta om den här veckans väder,sv
8529,weather,weather,ge mig vädret i stockholm vid tre på eftermiddagen,sv
4393,takeaway,takeaway,var god beställ åt mig pizza och kycklingvingar från pizza hut nu,sv
12151,transport,transport,boka en biljett till stockholm med s. l. i helgen,sv
1436,alarm,alarm,vilka larm har jag,sv
10201,cooking,cooking,vad är stegen för biryani måltid,sv
16390,email,email,vilka olästa mejl har jag,sv
15386,social,social,lägg upp bilden jag nyss tog på twitter,sv
8738,calendar,calendar,ta bort händelsen från kalendern,sv
5238,news,news,visa de senaste nyheterna om invandring,sv
2180,datetime,datetime,tid tack,sv
9386,play,play,jag vill att du hittar bra kanaler att lyssna på,sv
16108,email,email,vad är jennys hemtelefonnummer,sv
14141,qa,qa,vad är växelkursen mellan det brittiska pundet och amerikanska dollarn,sv
8485,calendar,calendar,vilken tid börjar styrelsemötet på fredag,sv
3639,news,news,visa nyheter från s. v. t.,sv
8544,calendar,calendar,rensa alla mina kalender evenemang,sv
16576,email,email,har johan skickat ett svar till mig via mejl än,sv
11811,recommendation,recommendation,vad spelas på filmstaden,sv
10144,cooking,cooking,hur länge ska jag kyla en icebox paj,sv
15926,email,email,skicka ett mejl till eva som berättar för henne att min telefon fungerar igen,sv
13295,general,general,vad är receptet på chokladbitar,sv
960,iot,iot,skruva upp ljuset,sv
13287,general,general,förklara definitionen av inflation och berätta hur det är viktigt för varje ekonomi,sv
10315,play,play,spela jag har aldrig,sv
4535,news,news,vad är huvudrubrikerna på göteborgs posten,sv
3939,music,music,kan du spara denna låten till mina favoriter,sv
8139,calendar,calendar,är det torsdag imorgon,sv
10675,lists,lists,berätta något intressant på meddelandelistan åt mig,sv
12404,transport,transport,vilken tid kommer tåget till nästa station,sv
1240,play,play,spotify,sv
888,datetime,datetime,vilken tid har vi just nu,sv
268,iot,iot,gör lamporna ljusare,sv
5000,play,play,spela hatar att vara kär härnäst,sv
10668,lists,lists,berätta om listan,sv
16031,email,email,olly öppna nytt mejl till denna medarbetare på denna mejl,sv
8275,calendar,calendar,var god radera jacobs födelsedag från kalendern,sv
4743,alarm,alarm,hej google berätta vilka larm som är aktiverade åt mig,sv
7457,calendar,calendar,var god boka om mötet till klockan arton imorgon och meddela medlemmar,sv
15976,email,email,lägg till rebecka larsson till min lista av favorit kontakter,sv
6032,audio,audio,volym kontroll,sv
16747,email,email,har micke skickat mig ett mejl,sv
15118,qa,qa,vänligen kontrollera den senaste trenden i aktier,sv
12304,transport,transport,tåg tid till karlskrona,sv
2945,iot,iot,stäng av lampan i vardagsrummet,sv
11746,recommendation,recommendation,vilka filmer spelas ikväll vid nio vid göta lejon,sv
16963,email,email,läs mejl och skicka till familjemedlem,sv
8792,calendar,calendar,vilka är detaljerna för den här händelsen,sv
14392,qa,qa,definiera acceleration,sv
12990,qa,qa,vad är den lägsta befolkningen per kvadratkilometer i afrika,sv
16388,email,email,hej olly har jag några mejl från bob om bulldog,sv
4229,iot,iot,kan du släcka min sovrumslampa,sv
3188,news,news,vad är donald trump's nya immigrationpolitik,sv
13719,qa,qa,ska adele åka på turné,sv
3396,music,music,var den här låten i topp tjugo,sv
3422,music,music,vem är sångaren,sv
186,play,play,spela senaste låten från min favoritspellista,sv
9650,play,play,jag vill höra program ett på sveriges radio,sv
2457,datetime,datetime,g. m. t. tid,sv
4340,takeaway,takeaway,visa mig kinamat nära mig,sv
14724,qa,qa,hjälpmikrofon,sv
5710,weather,weather,kommer jag att behöva solskydd den här eftermiddagen,sv
432,weather,weather,hur är vädret just nu ute,sv
10147,cooking,cooking,sök upp recept för ostomelett med fyra ostar,sv
8232,calendar,calendar,jag gör inget denna vecka,sv
12209,transport,transport,är det några olyckor i skellefteå,sv
4395,audio,audio,tala högre tack,sv
8663,recommendation,recommendation,vilka evenemang händer i bjärred denna helg,sv
10064,cooking,cooking,hur många grönsaker bör jag äta varje dag,sv
16720,email,email,är patriks husnummer i mina kontakter,sv
5315,news,news,vad händer i världen just nu kolla s. v. t.,sv
15901,email,email,vad är johan's telefonnummer,sv
3902,play,play,starta satellitmusik flödet,sv
10820,lists,lists,vad finns på min lista idag,sv
930,music,music,upprepa den här låten,sv
13415,recommendation,recommendation,berätta för mig vilket ställe som är trevligast att åka till,sv
8368,calendar,calendar,planera mitt möte med stellan skarsgård klockan sex ikväll,sv
14718,qa,qa,kan jag få en aktieanalys av fabege och bonava,sv
16138,email,email,visa mig alla mejl som mottagits nyligen,sv
12763,transport,transport,jag behöver en tåg biljett till,sv
652,iot,iot,ljuskontroll släck lamporna i rummet,sv
12778,transport,transport,fixa en taxi,sv
15505,social,social,tvittra skatteverkets kundservice att jag har väntat i trettio minuter,sv
7010,calendar,calendar,skicka kalender möte till janne,sv
8167,calendar,calendar,lägg in i min kalender möte med fröken lajla på onsdag åtta på morgonen,sv
11726,recommendation,recommendation,gör en reservation för två på oliven,sv
10161,cooking,cooking,vad passar risvin med,sv
11684,recommendation,recommendation,jag skulle vilja veta evenemangen som händer häromkring,sv
8550,calendar,calendar,vilken tid är julfesten på kontoret,sv
9888,play,play,börja spela där jag slutade sagan om ringen,sv
2874,play,play,spela rap musik,sv
2212,music,music,repetera musiken,sv
11249,lists,lists,jona den här,sv
15787,email,email,har jag några mejl från arbetet,sv
16757,email,email,har jag några nya mejl,sv
6855,alarm,alarm,sätt ett larm vid klockan tio i morgon och märk det som möte,sv
5093,datetime,datetime,tiden,sv
11686,recommendation,recommendation,uppdatera mig med vilka evenemang som händer i mitt område,sv
14362,qa,qa,vad är chanserna att aktiemarknaden stänger under tvåhundra dagars medelvärde inom de kommande fjorton dagarna,sv
5185,news,news,är det några nyheter om president valet,sv
3157,alarm,alarm,om mitt paket visar att det är för leverans imorgon kan du ställa in ett larm en timme senare tack,sv
15669,social,social,skriv ett klagomåls tweet,sv
6606,recommendation,recommendation,topp tio filmer,sv
16429,email,email,vänligen skicka ett mejl till mamma som säger att jag kan klara det nästa vecka,sv
342,iot,iot,gör färdigt en kaffe till mig nu,sv
11769,recommendation,recommendation,ge mig en lista på saker att göra i helgen i borås,sv
244,news,news,vad händer i luleå,sv
11465,play,play,fortsätt till nästa podcast,sv
11793,recommendation,recommendation,jag vill se en bra tjejfilm har du några förslag,sv
2700,play,play,spela rockmusik,sv
6869,calendar,calendar,kan du synka min kalender med hans,sv
13586,qa,qa,har donald trump några band till ryssland,sv
8155,calendar,calendar,är mötet med julia klockan tre på eftermiddagen på onsdag,sv
6583,general,general,låt oss börja kompis,sv
14514,qa,qa,vem är u. s. as. nuvarande president,sv
16858,email,email,mejl den senaste halvtimmen,sv
10740,lists,lists,finns det plats på min inköpslista,sv
5153,music,music,upprepa senaste låten tack,sv
11893,recommendation,recommendation,händer det några evenemang denna helgen,sv
2645,iot,iot,sänk ljuset i vardagsrummet,sv
11405,play,play,välj näst poddavsnitt,sv
3657,music,music,vilken musik föredrar jag,sv
2880,audio,audio,öka volymen till sjuttio procent,sv
17130,email,email,skicka emejl till mamma som börjat med ämne semester,sv
9548,play,play,sätt på en av de förprogrammerade stationerna,sv
17163,email,email,skicka mejl till sara,sv
9464,play,play,spela hälsoshow på min telefon,sv
10937,lists,lists,töm lista saker att göra den här veckan,sv
16587,email,email,kolla efter nya mejl google,sv
1704,datetime,datetime,vad är klockan,sv
15255,social,social,kan någon tala om för mig vad det är ni diskuterar,sv
17014,email,email,svara mejlet,sv
6223,general,general,min dag var stressig,sv
3964,alarm,alarm,hur många alarm är satta,sv
6846,calendar,calendar,påminn mig ett mejl till min syster,sv
9207,play,play,sätt på radion google,sv
12113,recommendation,recommendation,några gårdsmarknader i närheten med lokala produkter,sv
6233,general,general,olly jag träffade min blivande fru idag boka en dejt till nästa fredag tack,sv
3579,audio,audio,bli tyst fram till tre,sv
558,alarm,alarm,har jag några larm inställda imorgon,sv
7265,calendar,calendar,ta upp min agenda,sv
1604,alarm,alarm,vilken tid är alarmet satt på för imorgon bitti,sv
2319,iot,iot,sänk styrkan på ljuset,sv
3648,weather,weather,hur är vädret i stockholm,sv
2019,iot,iot,växla ljuset till blått sen till grönt sen till gult,sv
7869,calendar,calendar,ta bort event från kalendern,sv
3327,news,news,ta upp nyheterna,sv
6910,calendar,calendar,vad är schemalagt för de kommande tre månaderna,sv
6702,weather,weather,idag väder,sv
8840,calendar,calendar,vilken tid är nästa evenemang bokad,sv
12184,transport,transport,finns det några vägarbeten på e. fyran,sv
12503,transport,transport,när går nästa tåg till alvesta,sv
998,iot,iot,släck lamporna i detta rummet,sv
569,datetime,datetime,hur många födelsedagar den tjugotredje,sv
6450,general,general,när är den första dagen med tjugo grader prognos,sv
4153,play,play,spela låten sommartider,sv
13696,general,general,berätta om den här personen,sv
9429,play,play,spela college baseboll spelet,sv
2650,news,news,vad är överskrifterna i dagens lokala morgonnyheter,sv
10074,cooking,cooking,hur länge kokar man ett ägg lätt,sv
16760,email,email,vänligen ge mig mina mejl,sv
5689,news,news,låt mig se de senaste nyheterna,sv
14948,qa,qa,olly beskriv vad en sädescirkel är,sv
3949,alarm,alarm,kan du sätta ett alarm åt mig,sv
3504,weather,weather,hur är vädret i stockholm idag,sv
3921,play,play,spela vilken musik som helst från det decenniet,sv
6727,calendar,calendar,radera chatt med klas,sv
11951,recommendation,recommendation,vilka restauranger med höga betyg finns det i området,sv
4370,audio,audio,höj volym till nivå sju på musikspelare,sv
15835,email,email,var vänlig svara mitt senaste mejl,sv
5913,music,music,berätta för mig namnet på kompositören,sv
2333,alarm,alarm,sätt larm på klockan sex på morgonen imorgon,sv
12167,transport,transport,hur är trafiken på sveavägen,sv
6706,general,general,har artificiell intelligens något medvetande,sv
40,general,general,kolla statusen på min el förbrukning,sv
16906,email,email,skicka ett mejl till min familj som frågar hur de mår,sv
12356,transport,transport,jag behöver en tåg biljett,sv
4437,weather,weather,kan jag ha på mig sandaler,sv
7072,calendar,calendar,skicka en notifikation en timme innan min nästa kalenderhändelse,sv
16905,email,email,skicka ett mejl till min familj som berättar om mina kommande födelsedagsplaner,sv
5002,iot,iot,öka ljusstyrkan på lampan,sv
7416,calendar,calendar,upprepa påminnelser för mina möten i jul,sv
16136,email,email,checka mejl och vad är det senaste ämnet,sv
7789,calendar,calendar,låt mig inte glömma att ringa alex,sv
1706,iot,iot,var snäll stäng av den högra lampan,sv
12549,transport,transport,vägbeskrivning till stockholm,sv
721,alarm,alarm,skapa ett alarm klockan fyra imorgon bitti,sv
11830,recommendation,recommendation,var kan jag köpa sportutrustning nära mig,sv
3172,iot,iot,sänk styrkan på ljuset,sv
653,play,play,hitta lite gospelmusik,sv
9346,play,play,spela den här radiokanalen för mig,sv
12428,transport,transport,jag behöver en taxi nu,sv
4812,datetime,datetime,den tjugoandra är vilken dag,sv
5327,play,play,hitta lite musik åt mig,sv
912,play,play,spela min favorit pandora station,sv
3356,music,music,jag älskar indierock,sv
15752,email,email,hitta alla mejl åt mig från magda med semesterord i rubriken,sv
10739,lists,lists,jag vill veta kan en till artikel lägga still i min inköpslista,sv
14896,qa,qa,var åkte oden på sin sista resa,sv
75,music,music,vem skrev nuvarande musiken,sv
3226,play,play,jag vill lyssna på låt ett,sv
14964,qa,qa,alexa vad är google,sv
15820,email,email,ändra min mammas mejl i min telefonbok,sv
135,takeaway,takeaway,dominos utkörnings status,sv
3638,play,play,sätt på astrologen av magnus uggla,sv
14401,general,general,berätta det senaste jag frågade dig att kolla upp åt mig,sv
12462,transport,transport,boka uber ikväll klockan sju på kvällen,sv
1049,audio,audio,ändra ljud inställningarna,sv
8982,calendar,calendar,radera min tidsbokning med jonas,sv
8120,calendar,calendar,är det marias födelsedagskalas ikväll,sv
13893,qa,qa,jag vill ha lite information om lisa ekdahl,sv
9770,play,play,spela vinnarna efter trettio minuter,sv
14155,qa,qa,googla saken och se,sv
773,news,news,vad är de senaste nyhetern från s. v. t.,sv
12510,transport,transport,google sök boka tågbiljett,sv
16019,email,email,kan du berätta för mig om jag fått några olästa mejl idag,sv
14714,qa,qa,är hans alfredson fortfarande vid liv,sv
23,iot,iot,dämpa lamporna i köket,sv
2855,weather,weather,regnar det idag,sv
13012,qa,qa,vad är evighet,sv
13136,qa,qa,hur många länder,sv
13874,qa,qa,berätta när nästa stora jordbävning kommer att inträffa i kalifornien,sv
16561,email,email,kolla min mejl,sv
4493,iot,iot,ändra färgen på mina lampor till något slumpmässigt,sv
14672,qa,qa,vilken land skulle konvertera mest pengar från tusen amerikanska dollar,sv
8346,calendar,calendar,påminn dig själv att påminna mig om att behövde vara påmind om det där mötet,sv
14831,qa,qa,hitta brad pitt's ålder,sv
11198,lists,lists,ta bort min att göra lista,sv
3246,weather,weather,berätta om vädret i stockholm,sv
44,general,general,olly jag är inte trött jag är faktiskt glad,sv
13946,qa,qa,vad sägs om tina johnson,sv
12440,transport,transport,vilka resor är tillgängliga från stockholm till malmö,sv
11935,recommendation,recommendation,vad händer i helgen runt mitt postnummer,sv
1350,weather,weather,hur blir vädret den här veckan,sv
6428,general,general,filmer,sv
3612,weather,weather,kommer det att regna kommer det,sv
14287,qa,qa,berätta om magdalena andersson för mig,sv
13207,qa,qa,leta upp etymologi på google,sv
6553,news,news,vad händer inom popindustrin,sv
7480,calendar,calendar,finns det någon påminnelse som är mest brådskande,sv
5801,weather,weather,tror du att jag kan ha på mig sandaler eller borde jag använda sneakers ikväll vid sju på kvällen,sv
66,play,play,spela yesterday av beatles,sv
16337,email,email,berätta om mina nya mejl,sv
2477,play,play,spela bara klassisk musik,sv
15278,calendar,calendar,vilka är mina notifikationer,sv
11475,play,play,spela nästa podcast,sv
5420,iot,iot,sätt på wemo uttaget tack,sv
3388,weather,weather,hur kommer vädret att bli i stockholm idag,sv
1021,music,music,finns det någon rap som inte involverar sex pengar och droger,sv
1725,weather,weather,hur blir vädre kommande sju dagar,sv
4009,iot,iot,gör lamporna mörkare,sv
4974,play,play,spela det gör ont,sv
9066,calendar,calendar,har jag en match den sjunde april,sv
9372,play,play,spela sportstationen,sv
6100,alarm,alarm,vilka hemalarm har ställts in,sv
5665,weather,weather,behöver jag använda solglasögon utomhus,sv
7803,calendar,calendar,skapa en återkommande påminnelse för mitt yogapass varje dag vid tolv,sv
16658,email,email,skicka ett mejl till tobias som frågar hur vädret kommer vara denna veckan,sv
4943,audio,audio,prata tystare tack,sv
13553,general,general,visa mig en karta över vart katten har varit denna veckan,sv
3626,news,news,s. v. t. världs nyheter,sv
2559,play,play,spela musik av korn,sv
3888,takeaway,takeaway,ring rosegarden och beställ nummer sju tack,sv
5790,weather,weather,är det varmt idag,sv
2930,music,music,jag gillar denna låten vad är det kan du upprepa den en gång tack,sv
7568,calendar,calendar,datum för anslutning,sv
10174,cooking,cooking,hitta ett bra recept för biff,sv
1601,play,play,spela låtar från titanic,sv
11696,recommendation,recommendation,vilka filmer visas på den lokala bion,sv
14944,qa,qa,berätta när indien's ekonomi kommer bli likvärdig u. s. a.,sv
6392,general,general,jag shoppade idag och köpte en jättestor dildo,sv
12971,general,general,olly har du något råd till mig hur jag ska hantera,sv
14629,qa,qa,geografi melbourne,sv
8942,calendar,calendar,radera allt den här månaden,sv
9241,play,play,jag vill höra de bästa country låtarna från nittiotalet,sv
12975,qa,qa,kalkylera ohms lag baserad på dessa värden,sv
2698,takeaway,takeaway,beställ två ostburgare från mcdonalds på university drive,sv
15189,social,social,kolla mitt senaste inlägg på instagram,sv
16055,email,email,skicka mejl till sven för camilla,sv
1508,audio,audio,sätt tyst läge i en timme,sv
9356,play,play,sätt på lugna favoriter på radion,sv
214,datetime,datetime,vilken dag är det idag,sv
16312,email,email,skicka ett mejl till fredrik på jobbet,sv
4518,takeaway,takeaway,när är min beställning klar,sv
