id,label,label_text,text,lang
8028,calendar,calendar,vilka event har jag schemalagt idag,sv
16306,email,email,vänligen skicka ett mejl till min familj,sv
1287,datetime,datetime,vad är aktuell tid,sv
15107,recommendation,recommendation,vilken film rekommenderar du ikväll,sv
15907,email,email,skicka kommer att göra det tack till johan som ett svar på hans senaste meddelande,sv
659,datetime,datetime,tid nu i new york,sv
4414,weather,weather,kommer det att bli regn i stockholm nästa tisdag,sv
13956,qa,qa,vad är en banan,sv
1737,iot,iot,sänk ljuset i hallen,sv
8759,calendar,calendar,var är evenemanget idag,sv
7649,calendar,calendar,ta bort alla händelser från kalendern,sv
6237,general,general,hur går det,sv
15179,social,social,vilka är de senaste tweetsen från aftonbladet,sv
4716,alarm,alarm,lägg in följande larm,sv
9104,calendar,calendar,var det ett möte bokat på lördag,sv
8476,calendar,calendar,radera det här eventet tack,sv
7298,calendar,calendar,påminn att jag har möte klockan fem,sv
4540,audio,audio,skruva upp media volym,sv
3520,iot,iot,det är lite mörkt gör det ljusare,sv
7123,calendar,calendar,markera eventet varje månad,sv
5628,iot,iot,stäng av fläkten,sv
16607,email,email,kolla och töm spam från den senaste veckan,sv
7198,calendar,calendar,låt mig inte glömma flisans veterinärstidsbokning den tjugofemte,sv
3376,iot,iot,lampor till femtio procent,sv
952,weather,weather,är vädret dåligt i stockholm precis nu,sv
3043,alarm,alarm,återställ larm,sv
4948,general,general,snälla berätta ett skämt som jag kommer tycka är rolig,sv
10813,lists,lists,alexa lägg till inköpslista i min att göra lista,sv
4139,weather,weather,behöver jag ha en tjock jacka idag,sv
11575,recommendation,recommendation,berätta om några intressanta evenemang här omkring,sv
15417,social,social,tweeta lång väntan och oproffessionella anställda,sv
8913,calendar,calendar,vad har jag att göra efter lunch idag,sv
7068,calendar,calendar,anpassa fliken för att visa din önskade tidsperiod,sv
4344,music,music,ge den här låten fem stjärnor i betyg och spara betyget,sv
8277,calendar,calendar,ta bort alla bokade handelsbankenmöten från kalendern tack,sv
10552,lists,lists,olly vad är på min att göra lista idag,sv
8144,calendar,calendar,lägg till en bröllopsfest denna söndag,sv
15680,social,social,för facebook skriv ny befordrad chef för tetra pak,sv
249,play,play,spela lite hiphop,sv
14606,qa,qa,okej google varför lämnade angelina jolie brad pitt,sv
9970,cooking,cooking,finns det något att göra med quinoa för att det inte ska smaka dåligt,sv
15874,email,email,var vänlig checka om där är ett nytt mejl i inkorgen,sv
14915,qa,qa,vilken är tysklands största flod,sv
9611,play,play,spela favoriserade radiostationer,sv
16785,email,email,har jag mottagit några mejl den senaste timmen,sv
17086,email,email,svara detta tack,sv
13971,qa,qa,beskriv,sv
4523,weather,weather,hur är vädret ute,sv
1857,audio,audio,ner,sv
12312,transport,transport,hur lång tid kommer det att ta för mig att ta mig till storgatan med tanke på nuvarande trafik,sv
12323,transport,transport,källa och destination,sv
2912,play,play,musik led zeppelin houses of the holy,sv
7109,calendar,calendar,glöm inte att möta lina idag vid klockan arton,sv
4444,transport,transport,du behöver ge mig olika vägbeskrivningar,sv
6308,general,general,jag äter frukost vid åtta f. m.,sv
12635,transport,transport,hitta ett direkt tåg till luleå,sv
7439,calendar,calendar,möte med anna denna fredag,sv
6418,calendar,calendar,öppna anteckningar lägg till anteckning om mitt möte,sv
7323,calendar,calendar,vänligen skriv i min kalender en tidsbokning med doktor marius för denna fredag vid sex på kvällen,sv
6632,general,general,kampsport,sv
10233,cooking,cooking,är fish and chips verkligen brittiskt,sv
3483,weather,weather,hur är vädret där hemma idag,sv
5487,datetime,datetime,hur många timmar återstår till middag,sv
16527,email,email,påminn mig när mamma skickar mig ett mejl,sv
6904,calendar,calendar,radera möte för gräsmattevård nästa månad,sv
1985,audio,audio,ändra volymen till tyst tack,sv
14037,qa,qa,var ligger stadsparken,sv
9708,play,play,spela räven raskar över isen i mediamapp,sv
16253,email,email,alexa kolla upp tor information,sv
4736,datetime,datetime,vilken dag är det idag,sv
7592,calendar,calendar,från fyra till sex när har jag rast,sv
14416,qa,qa,är svarta havet äkta,sv
10477,lists,lists,se till att bröd är på min inköps lista,sv
5583,play,play,assistent spela royksopp running to the sea,sv
4416,datetime,datetime,hur mycket är klockan i karleby,sv
594,play,play,sätt på klassisk musik under middagen nu,sv
1927,iot,iot,stänga av wemo uttaget i spelrummet,sv
5289,news,news,jag vill veta vad de senaste nyheterna,sv
16978,email,email,fick jag något meddelande från kevin,sv
15573,social,social,tweeta ett klagomål till kommunen,sv
13702,general,general,kolla kändis wiki,sv
13879,qa,qa,berätta för mig om michael jackson,sv
1852,iot,iot,det är för ljust här inne,sv
1118,news,news,ge mig de senaste politik nyheterna tack,sv
7855,calendar,calendar,ordna ett möte med min sons lärare på fredag,sv
16188,email,email,skicka mejl till jens om att möta mig idag på kvällen,sv
2314,iot,iot,alexa dämpa ljuset,sv
16159,email,email,lägg till en ny e postadress,sv
485,music,music,vad är längden på låten,sv
6185,general,general,vad händer under min dag,sv
5119,play,play,angel sommaren i city,sv
11568,recommendation,recommendation,var ligger närmaste burger king,sv
7739,calendar,calendar,jag ska inte till davids födelsedagsfest,sv
16084,email,email,vilka nya mejl har tagits emot,sv
4891,general,general,träffade du henne,sv
143,music,music,jag gillar inte den,sv
499,datetime,datetime,vad är klockan i des moines,sv
4454,datetime,datetime,vilken är den nuvarande tiden i delhi,sv
7301,calendar,calendar,vänligen organisera ett möte med mina kollegor,sv
4807,music,music,kom ihåg vad jag tycker om den här låten,sv
14711,qa,qa,vilket område har åtminstone tusen miles av öppen öken,sv
15234,social,social,hej olly posta mitt senast klickade foto på facebook med titeln god jul,sv
16571,email,email,skicka ett mejl till min syster,sv
9439,play,play,jag vill lyssna på dagens hits,sv
11173,lists,lists,vilka listor har jag,sv
3561,audio,audio,öka volymen tack,sv
11564,recommendation,recommendation,berätta om saker att göra i stockholm,sv
13431,qa,qa,visa meningen för högljudd,sv
5377,weather,weather,kolla vädret för tisdag tack,sv
2976,iot,iot,ändra dina färger till grönt,sv
8435,calendar,calendar,var god sätt jobbmöte klockan tolv på dagen för varje torsdag i februari,sv
1573,iot,iot,kör dammsugaren,sv
10942,lists,lists,vad finns på min rap spellista,sv
2786,general,general,också ett nöje,sv
5725,audio,audio,höj din volym,sv
7067,calendar,calendar,några händelser i min kalender idag,sv
16866,email,email,lägg till en email till mina kontakter tack,sv
14107,qa,qa,visa mig princes biografi,sv
14935,general,general,när är bästa tillfället att handla på target så att jag slipper ta itu med massor av människor,sv
9163,calendar,calendar,google finns det några event i min kalender denna vecka,sv
9598,play,play,alexa spela sveriges radio f. m. bandet på radion,sv
16211,email,email,skicka ett mejl till pappa som säger hur är vädret denna veckan,sv
111,play,play,sätt på lite coldplay,sv
3963,alarm,alarm,finns det några larm idag,sv
3797,iot,iot,ändra lamporna,sv
3347,news,news,berätta om de största nyheterna,sv
14634,qa,qa,hur lång är klarälven,sv
4575,takeaway,takeaway,jag vill beställa hämtmat,sv
9165,calendar,calendar,google ställ in en påminnelse för mitt möte idag,sv
9939,cooking,cooking,vilken temperatur borde oljan vara för att fritera pommes frites,sv
2407,music,music,är den här låten en klassisk låt,sv
3053,iot,iot,lampor av i barnens sovrum tack sen byt lamporna i mitt rum till röd färg,sv
14659,qa,qa,hur många bor i dalarna,sv
4050,general,general,kan du snälla berätta ett skämt,sv
9418,play,play,lyssna på bandit rock radio,sv
9081,calendar,calendar,dagen efter imorgon kommer genomföra alla möten,sv
9488,play,play,börja spela f. m. ett noll nio,sv
4285,weather,weather,vad är högsta temperaturen för den här veckan,sv
12822,transport,transport,hitta tåg tabeller till stockholm,sv
7875,news,news,vad hände förra veckan,sv
16414,email,email,öppna mejl kolla meddelanden,sv
16664,email,email,när fick jag senast ett nytt mejl,sv
7361,calendar,calendar,var god radera nästa födelsedags evenemang,sv
152,audio,audio,ändra volymen,sv
12396,transport,transport,boka en tågbiljett till stockholm,sv
16060,email,email,svara på mejlet från min bank och meddela dem att jag har betalat kreditkortsavgiften,sv
10920,lists,lists,hur många artiklar finns på min lista,sv
8361,calendar,calendar,påminn mig varje tisdag att gå till kemtvätten,sv
12433,transport,transport,jag behöver en tågbiljett till boden,sv
15226,social,social,vad är nytt på facebook,sv
14334,qa,qa,hur högt är åmliden,sv
5139,news,news,vad är valresultatet idag,sv
2267,takeaway,takeaway,beställ det vanliga från turiellos pizza,sv
1751,iot,iot,alla lampor på högra sidan av,sv
8662,calendar,calendar,lägg till löningsdag i min kalender på varannan torsdag,sv
6465,news,news,vilka är de trendande ämnena i världen,sv
17097,email,email,vad är roberts telefonnummer,sv
9430,play,play,spela djurgården och a. i. k. matchen,sv
11807,recommendation,recommendation,olly vart kan jag gå och handla häromkring,sv
4386,music,music,vad är nuvarande spårinformation,sv
82,iot,iot,höj ljuset till max tack,sv
3189,news,news,har kriget i syrien slutat,sv
5293,alarm,alarm,ställ alarm,sv
3645,play,play,spela musik av den där artisten,sv
661,datetime,datetime,kan jag få vet vilken tid det kommer vara klockan sex e. m. här i australien tack,sv
3432,play,play,spela dansbands musik,sv
4195,play,play,spela stad i ljus med tommy körberg,sv
694,takeaway,takeaway,kolla upp utkörning på min nuvarande beställning,sv
16578,email,email,har sara en ny e postadress listad,sv
551,music,music,vem sjunger denna låt,sv
7428,calendar,calendar,kan du visa mina kommande evenemang,sv
8020,calendar,calendar,sätt en påminnelse för morgondagens möte med james,sv
8558,calendar,calendar,gör onsdag kväll vid fem på eftermiddagen alltid till att vara ett möte med filip i min kalender,sv
16707,email,email,var bor johan larsson och vad är hans telefonnummer,sv
8157,calendar,calendar,är det tjejkväll denna helg,sv
802,audio,audio,ok google tysta ljudet på högtalare tack,sv
14854,qa,qa,hur djup är den djupaste punkten i grand canyon,sv
17002,email,email,vilket är det senaste mejlet jag mottog,sv
3266,music,music,ge denna sång fem stjärnor tack,sv
9808,play,play,spela tomas ledin album,sv
6753,calendar,calendar,avboka alla mina evenemang för idag tack,sv
9493,play,play,kan du spela rix f. m. hundraett komma två för mig,sv
13081,general,general,förklara teorin om mörk materia och visa mig dess tillämpningar,sv
7552,news,news,berätta vad som hände mellan åtta och nio idag,sv
3192,music,music,ge fem stjärnor till denna låt,sv
1080,weather,weather,ge mig morgondagens väderuppdatering,sv
16167,email,email,jag behöver skicka ett svar till charlotte,sv
3084,iot,iot,lättare nyans på lamporna tack,sv
722,alarm,alarm,skapa ett alarm att väcka mig efter fem timmar,sv
13781,qa,qa,definition av identifiering,sv
10874,lists,lists,kan du ta bort min att göra lista,sv
6589,general,general,definitioner,sv
9109,calendar,calendar,göra en kalenderanteckning utställning fotografiska den tjugofemte mars,sv
5680,play,play,spela all jazz musik,sv
8031,calendar,calendar,när är min tandläkartid i kalendern,sv
401,play,play,musik tack,sv
460,audio,audio,prata högt tack,sv
8077,calendar,calendar,påminn mig att hämta posten om tio minuter,sv
7079,calendar,calendar,ta bort alla poster i min kalender,sv
6065,audio,audio,svara inte på femtio sekunder,sv
5366,news,news,sök på google på ämnet,sv
4806,general,general,jag behöver ett bra skämt,sv
5161,alarm,alarm,ring mig sex på morgonen,sv
5252,weather,weather,jag kan gå ut utan paraply,sv
14795,qa,qa,vad står apple aktien i,sv
2746,iot,iot,ändra lampan i vardagsrummet till gul,sv
8881,alarm,alarm,schemalägg ett alarm för nästa veckas tandläkartid,sv
5601,weather,weather,hur är väderprognosen,sv
9865,play,play,spela den här ljudboken för mig,sv
7197,calendar,calendar,påminn mig om min systers födelsedagsfest imorgon en timme innan den börjar,sv
15031,qa,qa,vad är definitionen av ordet kaotisk,sv
3051,iot,iot,olly ändra färgen på min lampa till blått och stäng av lampan i köket tack,sv
5747,datetime,datetime,vad är det för dag den tjugotredje mars,sv
6611,general,general,starta en konversation med mig om sport,sv
10923,lists,lists,ta bort lunch med arbetskollegor på torsdag,sv
11763,recommendation,recommendation,vad finns det att göra i jönköping,sv
8335,calendar,calendar,jag vill inte ha några evenemang listade i kalendern,sv
10089,cooking,cooking,vad är det bästa köttbulls receptet,sv
13472,qa,qa,när startade andra världskriget,sv
1912,alarm,alarm,sätt larm vid fem noll noll,sv
13007,general,general,vad tycker du var det bästa decenniet,sv
4503,datetime,datetime,hej olly vad är klockan i sandviken nu,sv
1986,audio,audio,sätt genomsnittet på enheten,sv
5340,datetime,datetime,kan du berätta vad tiden är just nu,sv
2502,iot,iot,sätt på det smarta uttaget tack,sv
12878,transport,transport,visa tåg som går till skövde efter klockan fjorton på lördag,sv
16682,email,email,skapa mejl till johan börja innehållet med jag är intresserad av att se bilen du har till salu kan vi boka en tid för att träffas skicka,sv
15710,social,social,tagga leverantören i min tweet,sv
10610,lists,lists,lägg till saken till en lista,sv
16909,email,email,lägg till en ny mejlkontakt till min lista,sv
4578,audio,audio,kan du skruva upp volymen,sv
7230,datetime,datetime,idag är måndag är det,sv
11805,recommendation,recommendation,vilka slags gratisaktiviteter kan jag hitta på lokalt denna vecka,sv
13485,general,general,varför människor som läser kanske inte är de mest artiga och välfödda,sv
16220,email,email,svara annas mejl att jag kommer tillbaka till henne,sv
155,iot,iot,sätt ljuset till femtio procent,sv
10095,cooking,cooking,nyttig mat,sv
14876,qa,qa,vad är medelhavsnivån på det stället,sv
7668,calendar,calendar,den följande veckan upprepa denna händelse tio på morgonen varje dag,sv
7913,calendar,calendar,ta bort händelsen på måndag,sv
15589,social,social,öppna bildinlägg,sv
7823,calendar,calendar,vad har jag idag,sv
15972,email,email,ta reda på om erik larsson har skickat ett mejl om budgetförfrågningarna,sv
3104,music,music,spara den här låten som favorit,sv
3697,iot,iot,sätt på detta uttag,sv
13050,qa,qa,när föddes bryan adams,sv
4929,alarm,alarm,sätt på mitt första schemalagda larm,sv
16397,email,email,kommer du att skicka mejlet till göran,sv
2981,news,news,hitta och läs för mig om världens händelser idag,sv
7887,calendar,calendar,vilka möten hade jag förra veckan,sv
9293,play,play,hitta radio med snack,sv
141,play,play,spela min favoritspellista,sv
9854,play,play,återgå till twilight ljuduppspelning,sv
3633,play,play,google jag ville höra min spellista av countrymusik,sv
8211,calendar,calendar,schemalägg ett möte med micke för nästa torsdag morgon,sv
4208,weather,weather,borde jag ha sandaler,sv
6680,news,news,vad händer i nyhetsväg,sv
14754,qa,qa,i vilken tidszon ligger cuba,sv
6943,calendar,calendar,sätt ett kalender event,sv
5878,music,music,jag älskar den eviga rösten på sångerskan hon är min favorit,sv
15878,email,email,leta upp min teamledares bostadsadress,sv
6957,calendar,calendar,rensa min kalender,sv
10619,lists,lists,jag vill starta en ny lista med elverktyg på rea till verkligt värde,sv
15566,social,social,låt max veta att jag hatar dem,sv
12690,transport,transport,hur är trafiken på e. fyran,sv
16302,email,email,berätta email adressen för faster ruth,sv
15295,social,social,vilka nya inlägg finns på min sida,sv
13195,qa,qa,hur lång är alexander skarsgård,sv
3541,play,play,jag vill lyssna på vågorna med uno sveningsson,sv
3782,play,play,väl r. and b. spellista från nittiotalet tack,sv
834,news,news,ge mig de senaste nyheterna från s. v. t. sport,sv
14649,cooking,cooking,hur man lagar mat,sv
6011,datetime,datetime,vad säger klockan,sv
14715,general,general,snälla förklara den kinesiska kulturen,sv
5492,alarm,alarm,kan du stänga av larmet åt mig,sv
10859,lists,lists,ta bort den händelsen från lista,sv
287,iot,iot,öka ljusstyrkan på lampan bredvid soffan,sv
12900,transport,transport,boka en tåg biljett åt mig för tredje juli,sv
12531,transport,transport,vilken tid går morgon tåget till karlskrona,sv
15517,social,social,snälla tweeta för mig om den dåliga servicen given av mcdonalds,sv
7425,calendar,calendar,visa mig påminnelser,sv
7178,email,email,skicka ett röstmeddelande till herr lars kontor om att möta honom den första februari tjugo sjutton klockan fem på kvällen,sv
6696,general,general,hej olly jag tappade min plånbok idag,sv
16051,email,email,checka yahoo mejl,sv
14180,qa,qa,vad är huvudstaden i sverige,sv
13442,qa,qa,hur gammal är cristiano ronaldo,sv
255,music,music,olly vilken musik brukar jag gillar after jobbet,sv
6691,general,general,hur kan jag göra din dag lite bättre,sv
5825,play,play,sätt eld och lågor i kö av victor leksell,sv
1707,audio,audio,skruva ner högtalarna till femtio procent,sv
308,takeaway,takeaway,beställ en takeaway macka och soppa från subways,sv
15390,social,social,hantera facebookstatus,sv
13931,qa,qa,kolla valutor,sv
8187,calendar,calendar,ge mig en dags varsel innan mitt nästa möte,sv
5260,music,music,lägg till denna låten i min musik,sv
15549,social,social,rapportera klagomål till samsung med en tweet,sv
16680,email,email,skapa ett mejl till min bror som frågar honom vid vilken tid han vill komma för middag,sv
5388,music,music,vem har skapat denna låten,sv
14160,qa,qa,vilket land har högst befolkningsmängd,sv
6383,general,general,säljer du något av min information till annonsörer,sv
9590,play,play,på rix f. m. kan du spela rix morronzoo,sv
2702,play,play,spela rock musik tack,sv
6748,calendar,calendar,berätta om min äldsta påminnelse,sv
3191,play,play,spela upp spellistan vi lyssnade på igår kväll,sv
6868,calendar,calendar,kan du sammanfatta kommande schemalagda händelserna,sv
11071,lists,lists,ta bort tomater från inköps lista tack,sv
6629,general,general,vad heter den bästa italienska restaurangen,sv
10906,lists,lists,skapa en ny lista till mig,sv
9835,play,play,musik ett,sv
3938,play,play,sök efter alla nirvanalåtar och spela upp dem,sv
3156,alarm,alarm,micke kommer att skicka ett mejl till mig imorgon kan du ställa in ett larm femton minuter efter att jag fått det mejlet,sv
2513,iot,iot,hur ställer jag in tiden för min kaffebryggare,sv
2617,news,news,säg till mig om det är någon uppdatering i flygkraschhistorien tack,sv
7988,calendar,calendar,vad händer imorgon kväll,sv
5348,iot,iot,ge mig lite dämpat ljus,sv
13096,qa,qa,hur många hav finns det i världen,sv
8389,calendar,calendar,påminn mig på måndag vid två på eftermiddagen att ha ett möte med lars,sv
13590,qa,qa,vad är temperaturen just nu i solvalla,sv
2878,alarm,alarm,ta bort alla larm imorgon,sv
10428,lists,lists,ta bort min shoppinglista,sv
2290,iot,iot,instruera kaffebryggaren att ha filter kaffet redo om tio minuter,sv
13664,qa,qa,ge mig fakta om stockholms stadion,sv
16704,email,email,har jag mottagit några mejl de senaste två timmarna,sv
4038,takeaway,takeaway,beställ pizza från domino's,sv
10476,lists,lists,ta bort ananas från inköpslistan,sv
14257,qa,qa,visa växlingskursen mellan svenska kronor och danska kronor,sv
10601,lists,lists,jag tror att jag fick slut på detta kan du lägga till det i min lista,sv
16331,email,email,skriv ner mejl innehåll,sv
13260,qa,qa,lista de kändisar som har varit i mitt land under de senaste fem åren,sv
10469,lists,lists,kan du skapa en ny lista i spellistan,sv
2964,play,play,snälla spela alla låtar av bruno mars,sv
13169,recommendation,recommendation,vilka butiker har den billigaste enkilos rumpsteken,sv
6244,general,general,jag hade en avkopplande dag idag,sv
13577,general,general,hur gör hon sin sminkning,sv
6206,general,general,idag blev jag riktigt trött,sv
3781,play,play,jag skulle älska att höra spellistan jag gjorde för mitt bröllop,sv
6862,calendar,calendar,meddela mig om kommande evenemang,sv
10065,cooking,cooking,vilka kryddor finns i indisk mat,sv
450,iot,iot,gör kaffe olly,sv
6021,general,general,vad är det senaste skämtet,sv
14575,qa,qa,vilken valuta använder england,sv
5197,iot,iot,kan jag få en kopp kaffe,sv
5437,news,news,vad är huvudrubrikerna på expressen,sv
6971,calendar,calendar,avbryt händelse,sv
4769,iot,iot,stäng av wemo uttaget,sv
9159,calendar,calendar,ola skapa en händelse i min kalender,sv
948,music,music,jag gillar bakgrunds låten,sv
11037,lists,lists,ta bort mamma från min kontaktlista,sv
13733,qa,qa,vad är priset för en ford aktie,sv
9295,play,play,öppna p. tre radio,sv
11116,lists,lists,lägg till nya artiklar i alarmlistan,sv
1506,iot,iot,sätt på wemokontakten,sv
12929,transport,transport,starta g. p. s. för att leda mig,sv
1394,datetime,datetime,vad är klockan nu,sv
8286,calendar,calendar,har jag en fest planerad den här helgen,sv
5729,iot,iot,släck lamporna tack,sv
12164,transport,transport,kan du boka en tågbiljett åt min far,sv
330,audio,audio,tystare,sv
16660,email,email,vem var den senaste personen som mejlade mig,sv
14262,qa,qa,vad betyder ordet komplott,sv
15351,social,social,kom i kontakt med leo,sv
15529,social,social,tvittra googles kundtjänst deras produkter är underlägsna,sv
5512,alarm,alarm,sätt på mitt larm,sv
1701,iot,iot,starta min robotdammsugare dagligen mellan tio och elva på förmiddagen,sv
10659,lists,lists,ta bort sak fyra,sv
7226,calendar,calendar,kom ihåg nästa veckas fika,sv
84,iot,iot,sätt på städroboten,sv
9557,play,play,vad är serien med flest tittare på teve,sv
2785,iot,iot,starta dammsugning,sv
1463,news,news,ge mig nyhetsuppdateringar om nigeria,sv
14851,qa,qa,vad är resultatet av hundra minus femtio,sv
12786,transport,transport,vilken tid ankommer tåget,sv
7453,calendar,calendar,får jag be dig lägga till en ny händelse i min kalender,sv
932,music,music,spara denna låten tack,sv
17055,email,email,lägg till ett nytt mejl i mina kontakter från johan,sv
2045,iot,iot,ljuset är för mycket,sv
6474,weather,weather,hur är vädret,sv
14832,qa,qa,vad är kändisens nettovärde,sv
433,weather,weather,hur varmt är det just nu,sv
12243,transport,transport,boka en taxi imorgon på morgonen,sv
557,alarm,alarm,hur många alarm finns listade,sv
787,weather,weather,hur är vädret idag,sv
12223,transport,transport,olly hur är trafiken,sv
8734,calendar,calendar,vilka påminnelser har jag idag,sv
9731,play,play,spela da vinci koden,sv
3239,iot,iot,stäng av alla lampor i huset tack,sv
5345,iot,iot,gör en kanna starkt kaffe,sv
15992,email,email,skicka e post till adam petersson lycka till och lägg till arbetspdf,sv
893,play,play,spela musik nu,sv
2866,takeaway,takeaway,snälla kolla om mcdonalds har utkörning,sv
2648,music,music,vänligen kolla min spellista för jazzmusik,sv
1263,alarm,alarm,hur många larm har jag,sv
9652,play,play,olly spela netflix på min p. s. fyra,sv
10862,lists,lists,jag behöver ta bort artikel söder från min lista,sv
5716,play,play,sätt låtarna i ordning först per gessle sen miriam bryant och sen victor leksell,sv
1767,datetime,datetime,omvandla klockan fem från g. m. t. plus fyra till g. m. t. plus två,sv
5864,news,news,ge mig de senaste nyheterna om donald trump,sv
3549,play,play,spela arvingarna med blandning,sv
5467,weather,weather,behövs det solglasögon,sv
6329,general,general,det finns vissa delar av min dag där jag känner mig utmattad olly,sv
715,news,news,ge mig en nyhetstidning,sv
6033,iot,iot,gör njutningsdryck åt mig,sv
3567,datetime,datetime,vad är nuvarande datum i indien,sv
17160,email,email,spara mina kontakter,sv
14538,qa,qa,förklara rock för mig,sv
7933,calendar,calendar,lägg in en tidsbokning för detta evenemang i min kalender,sv
29,iot,iot,damsug huset olly,sv
7018,calendar,calendar,radera nyårsafton från kalendern,sv
12658,transport,transport,hur tar jag mig från mitt hus till coop längs e. fyran,sv
16287,email,email,skicka ett födelsedagsmejl till min chef,sv
11170,lists,lists,visa lista,sv
5077,weather,weather,det verkar kallt,sv
4750,weather,weather,kommer det att snöa,sv
10575,lists,lists,ta bort mikael stenberg från kontaktlistan,sv
13528,qa,qa,kan du lista topp tio singlarna denna vecka,sv
17109,email,email,lägg till sam på gmail punkt kom till min kontaktlista,sv
1376,iot,iot,stäng av lamporna i badrummet tack,sv
16939,email,email,svara min adress till johan,sv
1296,news,news,ge mig nyheterna om dagens möte,sv
7082,calendar,calendar,jag behöver en påminnelse förö mitt möte klockan fem på eftermiddagen,sv
4350,datetime,datetime,vilken tid på dygnet är det i dallas,sv
1838,play,play,sök efter och spela de bästa låtarna med tomas ledin,sv
16552,email,email,är där olästa mejl i gmail,sv
12599,transport,transport,vad är den längsta tiden till en destination,sv
13153,qa,qa,vilka utmärkelser vann ane brun igår kväll,sv
4734,alarm,alarm,sätt larmet för klockan nio på helger,sv
7818,calendar,calendar,har jag ett möte imorgon,sv
604,weather,weather,hur kommer vädret vara en vecka från nu,sv
6631,general,general,vad tycker du om löfven,sv
